case_name,exploit_date,classification,technique,loss_usd,chain,bridgeHack,targetType,returnedFunds,defillamaId,language,source_url,parentProtocolId,exploit_dt,exploit_date_iso,case_id,protocol_id
Super Sushi Samurai,3/22/24,Protocol Logic,Infinite Mint and Dump,4800000.0,Blast,False,Gaming,,,Solidity,https://rekt.news/sss-rekt/,,2024-03-22,2024-03-22,super-sushi-samurai__2024-03-22__70d14a25,name#super-sushi-samurai
Unizen,3/8/24,Protocol Logic,External Call Vulnerability,2100000.0,Ethereum,False,DeFi Protocol,2100000.0,1336.0,Solidity,https://twitter.com/peckshield/status/1766210445415727608,,2024-03-08,2024-03-08,unizen__2024-03-08__4f10a911,defillama#1336
AutoShark,5/24/21,Ecosystem,Flashloan Incentive Rewards Exploit,745000.0,BSC,False,DeFi Protocol,,1074.0,,https://watchpug.medium.com/sharkfinance-performance-fee-minting-incident-analysis-4b2e3bd03923,,2021-05-24,2021-05-24,autoshark__2021-05-24__8498618a,defillama#1074
Siren,9/3/21,Smart Contract Language,Reentrancy,3450000.0,Polygon,False,DeFi Protocol,,203.0,Solidity,https://twitter.com/BlockSecTeam/status/1433682132090568705?s=20&t=yoeOhpvaWABdrYwfwtTJ0Q,,2021-09-03,2021-09-03,siren__2021-09-03__8f15bb3f,defillama#203
MangoFarmSol,1/7/24,Rugpull,Frontend Attack,2000000.0,Solana,False,DeFi Protocol,,,Rust,https://cointelegraph.com/news/funds-mangofarmsol-drained-community-rug-pull,,2024-01-07,2024-01-07,mangofarmsol__2024-01-07__ba67f480,name#mangofarmsol
MyAlgo,2/27/23,Infrastructure,Cloudflare Key Compromised,9200000.0,Algorand,False,Wallet,,,Javascript,https://twitter.com/zachxbt/status/1630375691886686208?s=20,,2023-02-27,2023-02-27,myalgo__2023-02-27__70079ec6,name#myalgo
Zunami Protocol,5/15/25,Protocol Logic,withdrawStuckToken() exploit,500000.0,Ethereum,False,DeFi Protocol,,1201.0,Solidity,https://x.com/ZunamiProtocol/status/1922993510925435267,,2025-05-15,2025-05-15,zunami-protocol__2025-05-15__e95900de,defillama#1201
Impermax V3,11/11/25,Protocol Logic,Zero-Rate Hack,380000.0,Base,False,DeFi Protocol,,5981.0,Solidity,https://x.com/hklst4r/status/1988339762537918895,parent#impermax-finance,2025-11-11,2025-11-11,impermax-v3__2025-11-11__8a4c1d3b,parent#impermax-finance
DAO Maker Vesting,8/12/21,Infrastructure,Private Key Compromised (Unknown Method),7000000.0,Ethereum,False,DeFi Protocol,,921.0,,https://cointelegraph.com/news/dao-maker-crowdfunding-platform-loses-7m-in-latest-defi-exploit,parent#dao-maker,2021-08-12,2021-08-12,dao-maker-vesting__2021-08-12__8d31bd3a,parent#dao-maker
M2 Exchange,10/31/24,Protocol Logic,Access Control Exploit,13700000.0,"Ethereum,Solana,Bitcoin",False,CEX,,,,https://x.com/CyversAlerts/status/1852303223903633572,,2024-10-31,2024-10-31,m2-exchange__2024-10-31__84979d5c,name#m2-exchange
UPCX,4/1/25,Protocol Logic,Upgraded ProxyAdmin + withdrawByAdmin Hack,,Ethereum,False,DeFi Protocol,,,Solidity,https://x.com/cyversalerts/status/1907046941906653633,,2025-04-01,2025-04-01,upcx__2025-04-01__b0f2b73c,name#upcx
four.meme,2/11/25,Protocol Logic,Liquidity Pool Exploit,183000.0,BSC,False,DeFi Protocol,,5174.0,Solidity,https://x.com/peckshieldalert/status/1889210001220423765,,2025-02-11,2025-02-11,four-meme__2025-02-11__fddf1169,defillama#5174
Multichain,7/10/21,Protocol Logic,Private Key Compromised (Bad ECDSA Implementation),7900000.0,"Ethereum,BSC,Fantom",True,CEX,,591.0,Solidity,https://rekt.news/anyswap-rekt/,,2021-07-10,2021-07-10,multichain__2021-07-10__24ec6c38,defillama#591
Kannagi,7/30/23,Rugpull,Drained Contracts,1100000.0,"zkSync Era,Ethereum",False,DeFi Protocol,,,,https://x.com/PeckShieldAlert/status/1685162644653973510,,2023-07-30,2023-07-30,kannagi__2023-07-30__b971f368,name#kannagi
xToken,5/12/21,Ecosystem,Flashloan Price Oracle Attack,24000000.0,Ethereum,False,DeFi Protocol,,206.0,Solidity,https://twitter.com/FrankResearcher/status/1392515198674681863?s=20,,2021-05-12,2021-05-12,xtoken__2021-05-12__5be55715,defillama#206
BingX,9/20/24,Infrastructure,Hot wallet hack,43300000.0,Ethereum,False,CEX,,4859.0,,https://x.com/OnchainDataNerd/status/1836977341094150398,,2024-09-20,2024-09-20,bingx__2024-09-20__a33b1282,defillama#4859
Thorchain DEX,7/22/21,Protocol Logic,Refund Logic Exploit,8000000.0,Ethereum,False,DeFi Protocol,,412.0,Solidity,https://rekt.news/thorchain-rekt2/,,2021-07-22,2021-07-22,thorchain-dex__2021-07-22__87eb8f99,defillama#412
DAO Maker Vesting,9/4/21,Protocol Logic,Access Control Exploit,4000000.0,Ethereum,False,DeFi Protocol,,921.0,Solidity,https://twitter.com/Mudit__Gupta/status/1434059922774237185?s=20&t=aoOtJLS6FHimjAE1anc1mg,parent#dao-maker,2021-09-04,2021-09-04,dao-maker-vesting__2021-09-04__e08768ad,parent#dao-maker
Safe Dollar,6/28/21,Protocol Logic,Incentive Rewards Exploit,248000.0,Polygon,False,DeFi Protocol,,424.0,Solidity,https://rekt.news/safedollar-rekt/,,2021-06-28,2021-06-28,safe-dollar__2021-06-28__3ce207bd,defillama#424
BetterBank,8/26/25,Protocol Logic,Infinite Mint and Dump,5000000.0,PulseChain,False,DeFi Protocol,,6611.0,Solidity,https://x.com/BetterBank_io/status/1960409391628189749,,2025-08-26,2025-08-26,betterbank__2025-08-26__278cc2cf,defillama#6611
Grand Base,4/15/24,Infrastructure,Private Key Compromised (Unknown Method),1700000.0,Base,False,DeFi Protocol,,,Solidity,https://twitter.com/PeckShieldAlert/status/1779796368732872856,,2024-04-15,2024-04-15,grand-base__2024-04-15__029fc2e1,name#grand-base
FixedFloat,2/18/24,Infrastructure,Private Key Compromised,26100000.0,"Ethereum,Bitcoin",False,DeFi Protocol,,,,https://cointelegraph.com/news/fixed-float-confirms-26m-exploit-bitcoin-ether,,2024-02-18,2024-02-18,fixedfloat__2024-02-18__ac850814,name#fixedfloat
Saddle Finance,4/30/22,Ecosystem,Flashloan Swap Logic Exploit,11000000.0,Ethereum,False,DeFi Protocol,,202.0,Solidity,https://rekt.news/saddle-finance-rekt2/,,2022-04-30,2022-04-30,saddle-finance__2022-04-30__bb7b012f,defillama#202
Nomad,8/1/22,Protocol Logic,Trusted Root Exploit,190000000.0,Ethereum,True,DeFi Protocol,,1682.0,Solidity,https://twitter.com/samczsun/status/1554252024723546112?s=20&t=mesLZTckBsl_X2_KbGcEHQ,,2022-08-01,2022-08-01,nomad__2022-08-01__df609a4e,defillama#1682
Elephant Money,4/12/22,Ecosystem,Flashloan Price Oracle Attack,22200000.0,BSC,False,DeFi Protocol,,1378.0,Solidity,https://twitter.com/BlockSecTeam/status/1513966074357698563,,2022-04-12,2022-04-12,elephant-money__2022-04-12__6bf7d7a5,defillama#1378
Euler V1,3/13/23,Protocol Logic,Flashloan Donate Function Logic Exploit,197000000.0,Ethereum,False,DeFi Protocol,240000000.0,1183.0,Solidity,https://twitter.com/peckshield/status/1635229594596036608?s=20,parent#euler,2023-03-13,2023-03-13,euler-v1__2023-03-13__c656e0c8,parent#euler
Unleash Protocol,12/30/25,Protocol Logic,Multisig Governance Hack,3900000.0,Story,False,DeFi Protocol,,5793.0,Solidity,https://x.com/UnleashProtocol/status/2005907998691229933,,2025-12-30,2025-12-30,unleash-protocol__2025-12-30__2dee68c9,defillama#5793
Orion Pools,2/2/23,Protocol Logic,Reentrancy,3000000.0,BSC,False,DeFi Protocol,,496.0,Solidity,https://twitter.com/peckshield/status/1621337925228306433?s=20&t=ZroERzkeCrxy3gHxtboQeA,parent#orion-protocol,2023-02-02,2023-02-02,orion-pools__2023-02-02__1c598c4a,parent#orion-protocol
DIMO,11/7/25,Protocol Logic,Private Key Compromised,40000.0,Ethereum,True,DeFi Protocol,,,,https://x.com/DIMO_Network/status/1986847282889957391,,2025-11-07,2025-11-07,dimo__2025-11-07__46d83b05,name#dimo
Locus Finance,12/30/23,Infrastructure,Private Key Compromised (Unknown Method),321000.0,"Ethereum,Arbitrum",False,DeFi Protocol,,3371.0,,https://twitter.com/Locus_finance/status/1744374506267767267,,2023-12-30,2023-12-30,locus-finance__2023-12-30__94d861a3,defillama#3371
Abracadabra Spell,1/30/24,Protocol Logic,Borrow Logic Exploit,6500000.0,Ethereum,False,DeFi Protocol,,347.0,Solidity,https://twitter.com/peckshield/status/1752279373779194011,parent#abracadabra,2024-01-30,2024-01-30,abracadabra-spell__2024-01-30__2a9202c2,parent#abracadabra
DEUS Finance,4/28/22,Ecosystem,Flashloan Price Oracle Attack,13400000.0,Fantom,False,DeFi Protocol,,1387.0,Solidity,https://twitter.com/peckshield/status/1519530463337250817?s=20&t=Mr6sVLBWq_A0ej9Y3-qstA,,2022-04-28,2022-04-28,deus-finance__2022-04-28__71e33e42,defillama#1387
Level Perps,5/1/23,Protocol Logic,Referral Claims Logic Exploit,1000000.0,BSC,False,DeFi Protocol,,2395.0,Solidity,https://twitter.com/peckshield/status/1653149493133729794?t=ojjCnRcDogo3lOKIy8cKgA&s=19,parent#level-finance,2023-05-01,2023-05-01,level-perps__2023-05-01__cc1491f3,parent#level-finance
CoinSpot,11/9/23,Infrastructure,Private Key Compromised (Unknown Method),2400000.0,Ethereum,False,CEX,,,,https://twitter.com/PeckShieldAlert/status/1722412658404843691,,2023-11-09,2023-11-09,coinspot__2023-11-09__fe23703d,name#coinspot
Alchemix,6/16/21,Protocol Logic,Borrow Logic Exploit,6500000.0,Ethereum,False,DeFi Protocol,,204.0,Solidity,https://forum.alchemix.fi/public/d/137-incident-report-06162021,,2021-06-16,2021-06-16,alchemix__2021-06-16__9dbe0b48,defillama#204
Peapods Finance,7/8/25,Ecosystem,Oracle manipulation in user-created Pods,175000.0,Ethereum,False,DeFi Protocol,,,Solidity,https://x.com/peckshield/status/1942542084214513996,,2025-07-08,2025-07-08,peapods-finance__2025-07-08__98d7d1e5,name#peapods-finance
Gala,5/20/24,Protocol Logic,Infinite Mint and Dump,22000000.0,Ethereum,False,DeFi Protocol,,,Solidity,https://x.com/Thatguysgems/status/1792679865164128743,,2024-05-20,2024-05-20,gala__2024-05-20__473c809d,name#gala
Curio,3/25/24,Protocol Logic,Voting Power Inflation,16000000.0,Ethereum,False,DeFi Protocol,,,Solidity,https://x.com/CyversAlerts/status/1772216818645565673,,2024-03-25,2024-03-25,curio__2024-03-25__fed6942b,name#curio
Tender Finance,3/7/23,Ecosystem,Outdated Oracle Exploit,1600000.0,Arbitrum,False,DeFi Protocol,850000.0,2382.0,Solidity,https://twitter.com/wasgiventhatday/status/1633056446278426624?s=20,,2023-03-07,2023-03-07,tender-finance__2023-03-07__ddbcbf65,defillama#2382
Rivus DAO,9/16/24,Rugpull,Third-party Dev Backdoor Exploit,,Ethereum,False,DeFi Protocol,,4574.0,Solidity,https://x.com/RivusDAO/status/1835782524746015137,,2024-09-16,2024-09-16,rivus-dao__2024-09-16__421a9494,defillama#4574
HyperVault,9/26/25,Rugpull,Drain Vaults,3600000.0,Hyperliquid L1,False,DeFi Protocol,,6597.0,Solidity,https://x.com/PeckShieldAlert/status/1971476404173930660,,2025-09-26,2025-09-26,hypervault__2025-09-26__25cd6766,defillama#6597
pump.fun,5/16/24,Infrastructure,Private Key Compromised (Unknown Method),2000000.0,Solana,False,DeFi Protocol,,4449.0,Rust/Anchor,https://x.com/FrankResearcher/status/1791164323047293325,parent#pump,2024-05-16,2024-05-16,pump-fun__2024-05-16__f28f28a9,parent#pump
Polter Finance,11/16/24,Protocol Logic,Flashloan Price Oracle Attack,12000000.0,Fantom,False,DeFi Protocol,,4152.0,,https://cointelegraph.com/news/polter-finance-12m-hack-response,,2024-11-16,2024-11-16,polter-finance__2024-11-16__98fd9036,defillama#4152
Sirio Finance,2/1/25,Protocol Logic,Flashloan Exploit,2000000.0,Hedera,False,DeFi Protocol,,5706.0,Solidity,https://x.com/SirioFinance/status/1885800736967024957,,2025-02-01,2025-02-01,sirio-finance__2025-02-01__ae7720cd,defillama#5706
ValueDefi,5/7/21,Protocol Logic,Math Mistake Exploit,11000000.0,BSC,False,DeFi Protocol,,164.0,Solidity,https://twitter.com/FrankResearcher/status/1390905494844313602?s=20,parent#value-finance,2021-05-07,2021-05-07,valuedefi__2021-05-07__f5a4076a,parent#value-finance
Conic Finance,7/21/23,Ecosystem,Flashloan Reentrancy Attack,3200000.0,Ethereum,False,DeFi Protocol,,2616.0,Solidity,https://twitter.com/ConicFinance/status/1682385596700844032?t=4a-w-I06_7EcbwpKWbPZHA&s=19,,2023-07-21,2023-07-21,conic-finance__2023-07-21__3e54d0c9,defillama#2616
BurgerSwap,5/28/21,Ecosystem,Flashloan Reentrancy Attack,7200000.0,BSC,False,DeFi Protocol,,1295.0,,https://twitter.com/FrankResearcher/status/1398114924337971201?s=20&t=vVNaBlQNJ9WXRT54vvCZ8w,,2021-05-28,2021-05-28,burgerswap__2021-05-28__46580f35,defillama#1295
Furucombo,2/27/21,Smart Contract Language,Delegatecall Exploit,14000000.0,Ethereum,False,DeFi Protocol,,742.0,Solidity,https://twitter.com/Kurt_M_Barry/status/1365876788757471234?s=20&t=LObPnVPhVbkYv7U9e-AL7w,,2021-02-27,2021-02-27,furucombo__2021-02-27__59b2feb1,defillama#742
JayPegs Automart,9/17/21,Rugpull,Redirected Deposits,3100000.0,Ethereum,False,DeFi Protocol,,,,https://rekt.news/jaypegs-automart-rekt/,,2021-09-17,2021-09-17,jaypegs-automart__2021-09-17__dd157e6d,name#jaypegs-automart
Lava,10/4/24,Protocol Logic,Flashloan Exploit,130000.0,Arbitrum,False,DeFi Protocol,,4241.0,Solidity,https://x.com/rotcivegaf/status/1842301803750470003,,2024-10-04,2024-10-04,lava__2024-10-04__f81367e2,defillama#4241
Nobitex,6/18/25,Infrastructure,Hot wallet hack,82000000.0,"Tron,Ethereum,BSC,Avalanche,Arbitrum,Polygon,Bitcoin",False,CEX,,,,https://x.com/QuillAudits_AI/status/1935237054155444611,,2025-06-18,2025-06-18,nobitex__2025-06-18__d12e5274,name#nobitex
Hedgey,4/19/24,Ecosystem,Claim Contract Flashloan Exploit,44700000.0,"Arbitrum,Ethereum",False,DeFi Protocol,,,Solidity,https://twitter.com/hedgeyfinance/status/1781257581488418862,,2024-04-19,2024-04-19,hedgey__2024-04-19__360c569d,name#hedgey
Harvest Finance,10/26/20,Ecosystem,Flashloan Price Oracle Attack,25000000.0,Ethereum,False,DeFi Protocol,,112.0,Solidity,https://rekt.news/harvest-finance-rekt/,,2020-10-26,2020-10-26,harvest-finance__2020-10-26__f9465a15,defillama#112
Yearn Ether,11/30/25,Protocol Logic,yETH stablepool Exploit,9000000.0,Ethereum,False,DeFi Protocol,,3973.0,Solidity,https://x.com/Togbe0x/status/1995240261816070482,parent#yearn,2025-11-30,2025-11-30,yearn-ether__2025-11-30__d2161d53,parent#yearn
Hedera,3/10/23,Protocol Logic,Unknown,515000.0,Hedera,False,DeFi Protocol,,,,https://rekt.news/hedera-rekt/,,2023-03-10,2023-03-10,hedera__2023-03-10__7349a265,name#hedera
Poloniex,11/10/23,Infrastructure,Private Key Compromised (Unknown Method),126000000.0,"Tron,Ethereum,Bitcoin",False,CEX,,,,https://twitter.com/peckshield/status/1722931275764474329,,2023-11-10,2023-11-10,poloniex__2023-11-10__ca39185b,name#poloniex
LeadBlock's Morpho Blue Market,10/14/24,Protocol Logic,Oracle Misconfiguration Exploit,250000.0,Ethereum,False,DeFi Protocol,,,Solidity,https://x.com/omeragoldberg/status/1845515843787960661,,2024-10-14,2024-10-14,leadblock-s-morpho-blue-market__2024-10-14__17ba573c,name#leadblock-s-morpho-blue-market
Vesper Finance,11/3/21,Protocol Logic,Oracle Manipulation,3370000.0,Ethereum,False,DeFi Protocol,,,Solidity,https://x.com/VesperFi/status/1455567032536248324,,2021-11-03,2021-11-03,vesper-finance__2021-11-03__56b15271,name#vesper-finance
Mango Markets V3,10/11/22,Ecosystem,Price Oracle Attack,115000000.0,Solana,False,DeFi Protocol,,286.0,Rust,https://twitter.com/joshua_j_lim/status/1579987648546246658?s=20&t=AFj8CwRWo5dFo_A1-A-18Q,parent#mango-markets,2022-10-11,2022-10-11,mango-markets-v3__2022-10-11__615785de,parent#mango-markets
Truflation,9/25/24,Infrastructure,Private Key Compromised (Malware),5000000.0,,False,Other,,,,https://www.theblock.co/post/318209/coinbase-ventures-backed-truflation-hacked-for-about-5-million-says-zachxbt,,2024-09-25,2024-09-25,truflation__2024-09-25__19edfc1c,name#truflation
SudoRare,8/23/22,Rugpull,Drained Contracts,800000.0,Ethereum,False,DeFi Protocol,,,Solidity,https://www.theblock.co/post/164970/nft-exchange-sudorare-suffers-800000-rug-pull-six-hours-after-launch,,2022-08-23,2022-08-23,sudorare__2022-08-23__a2cb6a93,name#sudorare
Steadefi,8/8/23,Protocol Logic,Deployer Wallet Compromised,1157000.0,Ethereum,False,DeFi Protocol,,2972.0,,https://twitter.com/steadefi/status/1688919583707877376,,2023-08-08,2023-08-08,steadefi__2023-08-08__53cd91a5,defillama#2972
Crypto.com,1/18/22,Infrastructure,Private Key Compromised (Unknown Method),33700000.0,"Ethereum,Bitcoin",False,CEX,,,,https://rekt.news/cryptocom-rekt/,,2022-01-18,2022-01-18,crypto-com__2022-01-18__d2f0cefe,name#crypto-com
0G Labs,12/11/25,Protocol Logic,emergencyWithdraw Function Exploit,516000.0,0G,False,DeFi Protocol,,,Solidity,https://x.com/CertiKAlert/status/1999481982858715247,,2025-12-11,2025-12-11,0g-labs__2025-12-11__8dacdd85,name#0g-labs
Dexible V2,2/20/23,Protocol Logic,Arbitrary External Call,2000000.0,"Ethereum,Arbitrum",False,DeFi Protocol,,2249.0,Solidity,https://twitter.com/RektHQ/status/1628030868043300865,,2023-02-20,2023-02-20,dexible-v2__2023-02-20__24b825c8,defillama#2249
Ooki,2/15/20,Protocol Logic,Flashloan Slippage Attack,350000.0,Ethereum,False,DeFi Protocol,,197.0,,https://www.coinbase.com/blog/around-the-block-analysis-on-the-bzx-attack-defi-vulnerabilities-the-state-of-debit-cards-in,,2020-02-15,2020-02-15,ooki__2020-02-15__6a1f3b12,defillama#197
Bond Protocol,10/21/22,Protocol Logic,Arbitrary External Call,300000.0,Ethereum,False,DeFi Protocol,,2697.0,Solidity,https://twitter.com/Supremacy_CA/status/1583425026094641153,,2022-10-21,2022-10-21,bond-protocol__2022-10-21__98f95a04,defillama#2697
Portal,2/2/22,Protocol Logic,Signature Exploit,326000000.0,Solana,True,DeFi Protocol,326000000.0,1541.0,Rust,https://twitter.com/samczsun/status/1489044939732406275?s=20&t=kfhTtvHGRyDbj-2P7f_hpA,,2022-02-02,2022-02-02,portal__2022-02-02__56d6f7ae,defillama#1541
Moola Market,10/18/22,Ecosystem,Price Oracle Attack,8400000.0,Celo,False,DeFi Protocol,,489.0,Solidity,https://twitter.com/FrankResearcher/status/1582448720985014273?s=20&t=vRg4YjjP30kMjt_V7I0gfg,,2022-10-18,2022-10-18,moola-market__2022-10-18__e49e48ea,defillama#489
FutureSwap,12/16/25,Protocol Logic,Flashloan Governance Attack,270000.0,Ethereum,False,DeFi Protocol,,228.0,Solidity,https://x.com/tenarmoralert/status/2001116475424133536,,2025-12-16,2025-12-16,futureswap__2025-12-16__0e04c582,defillama#228
Cover Protocol,12/29/20,Protocol Logic,Incentives Function Mistake,9400000.0,Ethereum,False,DeFi Protocol,,165.0,Solidity,https://coverprotocol.medium.com/12-28-post-mortem-34c5f9f718d4,,2020-12-29,2020-12-29,cover-protocol__2020-12-29__7c87c93f,defillama#165
Port3 Network,11/23/25,Protocol Logic,Infinite Mint and Dump,166000.0,BSC,False,DeFi Protocol,,,Solidity,https://x.com/Port3Network/status/1992471015948210277,,2025-11-23,2025-11-23,port3-network__2025-11-23__26ca622c,name#port3-network
NowSwap,9/15/21,Protocol Logic,Inconsistent Value in Code,1000000.0,Ethereum,False,DeFi Protocol,,,Solidity,https://x.com/BlockSecTeam/status/1438100688215560192,,2021-09-15,2021-09-15,nowswap__2021-09-15__08f1c813,name#nowswap
XBridge,4/24/24,Infrastructure,,1800000.0,"Ethereum,BSC",True,DeFi Protocol,,,Solidity,,,2024-04-24,2024-04-24,xbridge__2024-04-24__1ce3f0e4,name#xbridge
BNS,2/1/22,Infrastructure,Private Key Compromised (Unknown Method),7500000.0,,False,CEX,,,,https://twitter.com/zachxbt/status/1630665458134163476,,2022-02-01,2022-02-01,bns__2022-02-01__f6d5128c,name#bns
CoinEx,9/12/23,Infrastructure,Private Key Compromised (Unknown Method),55000000.0,"Ethereum,BSC,Bitcoin,Tron,Kadena,Solana,Dagger,XRP,BitcoinCash,Polygon,Stellar,Arbitrum",False,CEX,,,,https://www.coindesk.com/tech/2023/09/13/north-korean-attackers-linked-to-54m-coinex-hack-blockchain-data-suggests/,,2023-09-12,2023-09-12,coinex__2023-09-12__5edeab27,name#coinex
ZKsync,4/15/25,Infrastructure,Private Key Compromised (Unknown Method),5000000.0,zkSync Era,False,Other,,,Vyper,https://x.com/WuBlockchain/status/1912142777229754611,,2025-04-15,2025-04-15,zksync__2025-04-15__ed28162c,name#zksync
Orange Finance,1/8/25,Infrastructure,Private Key Compromised (Unknown Method),840000.0,Arbitrum,False,DeFi Protocol,,3422.0,Solidity,https://x.com/0xorangefinance/status/1876863611458801890,,2025-01-08,2025-01-08,orange-finance__2025-01-08__50dc5a13,defillama#3422
Tapioca DAO,10/18/24,Protocol Logic,Private Key Compromised (Social Engineering),4700000.0,Arbitrum,False,DeFi Protocol,,,Solidity,https://x.com/tapioca_dao/status/1847330264139145361,,2024-10-18,2024-10-18,tapioca-dao__2024-10-18__568b9630,name#tapioca-dao
Kinto Bridge,7/10/25,Protocol Logic,ERC1967Proxy Backdoor Hijack,1550000.0,Arbitrum,False,DeFi Protocol,,4336.0,Solidity,https://x.com/ramonrecuero/status/1943426114468352006,parent#kinto,2025-07-10,2025-07-10,kinto-bridge__2025-07-10__bc5e760d,parent#kinto
KyberSwap Classic,9/1/22,Infrastructure,Cloudflare Key Compromised,265000.0,Polygon,False,DeFi Protocol,,127.0,,https://blog.kyberswap.com/post-mortem-past-kyberswap-frontend-exploit-sept-2022/,parent#kyberswap,2022-09-01,2022-09-01,kyberswap-classic__2022-09-01__0efdb8d4,parent#kyberswap
Skyward Finance,11/2/22,Protocol Logic,Reentrancy,3000000.0,Near,False,DeFi Protocol,,,Rust,https://twitter.com/skywardfinance/status/1587947957789331457,,2022-11-02,2022-11-02,skyward-finance__2022-11-02__b8a3574b,name#skyward-finance
Exactly,8/18/23,Protocol Logic,DebtManager Exploit,7200000.0,Optimism,False,DeFi Protocol,,2385.0,Solidity,https://twitter.com/DeDotFiSecurity/status/1692549866713407912,,2023-08-18,2023-08-18,exactly__2023-08-18__b917380d,defillama#2385
Upbit,11/26/25,Infrastructure,Private Key Compromised,36000000.0,Solana,False,CEX,,,,https://x.com/layerggofficial/status/1993893233064333343,,2025-11-26,2025-11-26,upbit__2025-11-26__43704433,name#upbit
Popsicle Finance,8/3/21,Ecosystem,Flashloan Incentive Rewards Exploit,20000000.0,Ethereum,False,DeFi Protocol,,585.0,Solidity,https://twitter.com/Mudit__Gupta/status/1422797923037814786?s=20&t=bZ-0VnJ8b4SQbx5PkaOGYg,,2021-08-03,2021-08-03,popsicle-finance__2021-08-03__eb9a2690,defillama#585
Qubit,1/28/22,Protocol Logic,Transfer Logic Exploit,80000000.0,BSC,True,DeFi Protocol,,516.0,Solidity,https://medium.com/@QubitFin/protocol-exploit-report-305c34540fa3,,2022-01-28,2022-01-28,qubit__2022-01-28__8ed84f4d,defillama#516
Bald,8/2/23,Rugpull,Drained Liquidity Pool,23000000.0,Base,False,DeFi Protocol,,,,https://x.com/PeckShieldAlert/status/1686225428649062400,,2023-08-02,2023-08-02,bald__2023-08-02__6155b090,name#bald
Odin.Fun,8/12/25,Protocol Logic,Liquidity Manipulation Exploit,7000000.0,ICP,False,DeFi Protocol,,,Motoko,https://uk.finance.yahoo.com/news/memecoin-launchpad-odin-fun-suffers-103510880.html,,2025-08-12,2025-08-12,odin-fun__2025-08-12__ca7b24e5,name#odin-fun
OcelotDex,9/20/24,Protocol Logic,Infinite Mint and Dump,4900000.0,Ethereum,False,DeFi Protocol,,4095.0,Solidity,https://x.com/BlockscopeInc/status/1839049867987206329,,2024-09-20,2024-09-20,ocelotdex__2024-09-20__dc33eae0,defillama#4095
Tectonic,2/22/24,Protocol Logic,Flashloan New Market Exploit,250000.0,Cronos,False,DeFi Protocol,,1115.0,Solidity,https://cronoscan.com/tx/0x4c4584a57e5487a06e61c815c7ee368656ad58bd38774184eadcd97072dc1e4b,,2024-02-22,2024-02-22,tectonic__2024-02-22__444d99c3,defillama#1115
ApeRocket,7/14/21,Ecosystem,Flashloan Incentive Rewards Exploit,1260000.0,BSC,False,DeFi Protocol,,401.0,,https://www.google.com/search?q=aperocketfi+hack&oq=aperocketfi+hack&aqs=chrome..69i57j33i10i160j33i21.3640j0j4&sourceid=chrome&ie=UTF-8,,2021-07-14,2021-07-14,aperocket__2021-07-14__b8cb1e74,defillama#401
MonoX,11/30/21,Protocol Logic,Swap Function Exploit,31400000.0,"Ethereum,Polygon",False,DeFi Protocol,,948.0,Solidity,https://twitter.com/BlockSecTeam/status/1465690478414761992,,2021-11-30,2021-11-30,monox__2021-11-30__28616131,defillama#948
Hyperdrive HL,9/27/25,Protocol Logic,Router Exploit,773000.0,Hyperliquid L1,False,DeFi Protocol,,6298.0,Solidity,https://x.com/PeckShieldAlert/status/1972119238178754651,,2025-09-27,2025-09-27,hyperdrive-hl__2025-09-27__fdef03de,defillama#6298
Radiant V2,10/16/24,Protocol Logic,Access Control Exploit,53000000.0,"BSC,Arbitrum",False,DeFi Protocol,,2706.0,Solidity,https://x.com/AnciliaInc/status/1846618258163761551,parent#radiant,2024-10-16,2024-10-16,radiant-v2__2024-10-16__af6b8c7a,parent#radiant
SBI Crypto,9/24/25,Infrastructure,,24000000.0,"Bitcoin,Ethereum,Litecoin,Doge,BitcoinCash",False,Other,,,,https://www.coindesk.com/business/2025/10/01/sbi-crypto-reportedly-hit-by-usd21m-hack-with-suspected-dprk-links,,2025-09-24,2025-09-24,sbi-crypto__2025-09-24__a6109dbc,name#sbi-crypto
Abracadabra Spell,10/4/25,Protocol Logic,Sequential State Manipulation Exploit,1700000.0,Ethereum,False,DeFi Protocol,,347.0,Solidity,https://x.com/Phalcon_xyz/status/1974533451408986417,parent#abracadabra,2025-10-04,2025-10-04,abracadabra-spell__2025-10-04__391ee0ed,parent#abracadabra
OlaXBT,9/1/25,Ecosystem,Multisig wallet Social Engineering Exploit,2000000.0,BSC,False,DeFi Protocol,,,Solidity,https://x.com/CertiKAlert/status/1962439772280094975,,2025-09-01,2025-09-01,olaxbt__2025-09-01__dd160187,name#olaxbt
EasyFi,4/19/21,Infrastructure,Private Key Compromised (Unknown Method),59000000.0,Polygon,False,DeFi Protocol,,,,https://medium.com/easify-network/easyfi-security-incident-pre-post-mortem-33f2942016e9,,2021-04-19,2021-04-19,easyfi__2021-04-19__9a73ea8d,name#easyfi
Binance Bridge,10/6/22,Protocol Logic,Proof Verifier Bug,570000000.0,BSC,True,DeFi Protocol,,,,https://twitter.com/samczsun/status/1578167198203289600,,2022-10-06,2022-10-06,binance-bridge__2022-10-06__abb3d3d7,name#binance-bridge
Midas Capital,1/17/23,Ecosystem,Flashloan Reentrancy Attack,660000.0,Polygon,False,DeFi Protocol,,1925.0,Solidity,https://rekt.news/midas-capital-rekt/,,2023-01-17,2023-01-17,midas-capital__2023-01-17__8a566084,defillama#1925
Dough Finance,7/12/24,Protocol Logic,Unvalidated call data exploit,1960000.0,Ethereum,False,DeFi Protocol,,5109.0,Solidity,https://cointelegraph.com/news/dough-finance-loses-1-8m-flash-loan-attack,,2024-07-12,2024-07-12,dough-finance__2024-07-12__af2b11d5,defillama#5109
ParaSpace Lending V1,3/17/23,Protocol Logic,Borrow Logic Exploit,5000000.0,Ethereum,False,NFTfi,5000000.0,2517.0,Solidity,https://twitter.com/BlockSecTeam/status/1636650252844294144?s=20,,2023-03-17,2023-03-17,paraspace-lending-v1__2023-03-17__93b6994c,defillama#2517
Solareum,3/29/24,Infrastructure,Private Key Compromised (Social Engineering),1400000.0,Solana,False,DeFi Protocol,,,Move,,,2024-03-29,2024-03-29,solareum__2024-03-29__299f7003,name#solareum
Kame Aggregator,9/12/25,Protocol Logic,swap() Function Flaw,1300000.0,Sei,False,DeFi Protocol,,,,https://x.com/kame_agg/status/1967782820589568114,,2025-09-12,2025-09-12,kame-aggregator__2025-09-12__f4d07096,name#kame-aggregator
Cardex,2/18/25,Infrastructure,Private Key Compromised (Session signer),400000.0,Abstract,False,DeFi Protocol,,,Solidity,https://x.com/0xCygaar/status/1891948692204368122,,2025-02-18,2025-02-18,cardex__2025-02-18__3fa177ca,name#cardex
Munchables,3/26/24,Protocol Logic,Storage Slot Exploit,62500000.0,Blast,False,Gaming,,4369.0,Solidity,https://twitter.com/_munchables_/status/1772739713687752761,,2024-03-26,2024-03-26,munchables__2024-03-26__6005d91c,defillama#4369
Ronin Bridge,3/23/22,Infrastructure,Private Key Compromised (Social Engineering),624000000.0,Ethereum,True,DeFi Protocol,,4440.0,,https://roninblockchain.substack.com/p/back-to-building-ronin-security-breach,,2022-03-23,2022-03-23,ronin-bridge__2022-03-23__dec14498,defillama#4440
Superfluid,2/8/22,Protocol Logic,CTX Exploit,8700000.0,Polygon,False,DeFi Protocol,,693.0,Solidity,https://rekt.news/superfluid-rekt/,,2022-02-08,2022-02-08,superfluid__2022-02-08__d095828c,defillama#693
Earning.Farm,8/9/23,Protocol Logic,Reentrancy,540000.0,Ethereum,False,DeFi Protocol,,,Solidity,https://twitter.com/CyversAlerts/status/1689193286420795393,,2023-08-09,2023-08-09,earning-farm__2023-08-09__1945e063,name#earning-farm
Fortress Loans,5/8/22,Protocol Logic,Governance and Oracle Exploit,3000000.0,BSC,False,DeFi Protocol,,2177.0,Solidity,https://rekt.news/fortress-rekt/,,2022-05-08,2022-05-08,fortress-loans__2022-05-08__4c058729,defillama#2177
Corepound,9/23/25,Rugpull,Drained Contracts,430000.0,CORE,False,DeFi Protocol,,5952.0,,https://x.com/coreecosystem/status/1970584860516651113,,2025-09-23,2025-09-23,corepound__2025-09-23__931d1bc5,defillama#5952
Venus Core Pool,3/29/25,Protocol Logic,Donation Attack,902000.0,zkSync Era,False,DeFi Protocol,,212.0,Solidity,https://x.com/yonikesel/status/1905993100738134408,parent#venus-finance,2025-03-29,2025-03-29,venus-core-pool__2025-03-29__0433e834,parent#venus-finance
Lodestar V0,12/10/22,Ecosystem,Flashloan Price Oracle Attack,6900000.0,Arbitrum,False,DeFi Protocol,,2339.0,Solidity,https://twitter.com/BowTiedPickle/status/1601650177369993216?s=20&t=lv-ruhz34Xz7S_fZVFZj7w,parent#lodestar-finance,2022-12-10,2022-12-10,lodestar-v0__2022-12-10__0b379b23,parent#lodestar-finance
Ooki,11/5/21,Infrastructure,Private Key Compromised (Phishing),55000000.0,"Polygon,BSC",False,DeFi Protocol,,197.0,,https://medium.com/tidal-finance/bzx-incident-report-e36828347a86,,2021-11-05,2021-11-05,ooki__2021-11-05__1a9c2e02,defillama#197
LiFi Finance,7/16/24,Protocol Logic,Router Exploit via Infinite Approvals,9730000.0,"zkSync Era,Linea,Metis",True,DeFi Protocol,,,Solidity,https://x.com/RektHQ/status/1813329331105726812,,2024-07-16,2024-07-16,lifi-finance__2024-07-16__d4e24b27,name#lifi-finance
Holograph,6/13/24,Protocol Logic,Infinite Mint and Dump,6700000.0,Ethereum,False,DeFi Protocol,,,Solidity,https://www.coindesk.com/tech/2024/06/13/hlg-down-over-60-as-exploiter-mints-1-billion-new-tokens/,,2024-06-13,2024-06-13,holograph__2024-06-13__0d3b6ba3,name#holograph
Growth DeFi,2/9/21,Ecosystem,Flashloan Price Oracle Attack,1300000.0,Ethereum,False,DeFi Protocol,,159.0,Solidity,https://rekt.news/the-big-combo/,,2021-02-09,2021-02-09,growth-defi__2021-02-09__e54ec457,defillama#159
Loopscale,4/26/25,Protocol Logic,Price Oracle Manipulation,5800000.0,Solana,False,DeFi Protocol,,,Rust,https://x.com/LoopscaleLabs/status/1916183179469246626,,2025-04-26,2025-04-26,loopscale__2025-04-26__bc26e2f1,name#loopscale
AlphaPo,7/26/23,Infrastructure,Private Key Compromised (Unknown Method),60000000.0,"Ethereum,Tron",False,CEX,,,,https://rekt.news/alphapo-rekt/,,2023-07-26,2023-07-26,alphapo__2023-07-26__1034ac7e,name#alphapo
Stake.com,9/4/23,Infrastructure,Private Key Compromised (Unknown Method),41300000.0,"Ethereum,BSC,Polygon",False,Other,,,,https://twitter.com/web3isgreat/status/1698750534025441678,,2023-09-04,2023-09-04,stake-com__2023-09-04__dbd8b648,name#stake-com
DeltaPrime,7/23/24,Protocol Logic,,1000000.0,Arbitrum,False,DeFi Protocol,,2479.0,Solidity,https://x.com/DeltaPrimeDefi/status/1815536737206026346,,2024-07-23,2024-07-23,deltaprime__2024-07-23__f3821c66,defillama#2479
Blizz Finance,5/13/22,Infrastructure,Outdated Oracle Exploit,21800000.0,Avalanche,False,DeFi Protocol,,807.0,,https://rekt.news/venus-blizz-rekt/,,2022-05-13,2022-05-13,blizz-finance__2022-05-13__b3d69e7e,defillama#807
BearnFi,5/17/21,Ecosystem,Flashloan Withdraw Logic Exploit,18000000.0,BSC,False,DeFi Protocol,,387.0,,https://peckshield.medium.com/bearn-fi-incident-inconsistent-asset-denomination-between-vault-strategy-9b24b68ab1c0,,2021-05-17,2021-05-17,bearnfi__2021-05-17__96880f35,defillama#387
GMBL.COMPUTER,9/6/23,Protocol Logic,Referral Claims Logic Exploit,815000.0,Arbitrum,False,DeFi Protocol,,,,https://twitter.com/ImmuneBytes/status/1699338311230214536,,2023-09-06,2023-09-06,gmbl-computer__2023-09-06__bf26d778,name#gmbl-computer
GMX V1 Perps,9/18/22,Ecosystem,Price Oracle Attack,565000.0,Arbitrum,False,DeFi Protocol,,337.0,Solidity,https://twitter.com/jayantkrish/status/1571893643178569728?s=20&t=O--bs-V1Xnkmzm2JZOdZsw,parent#gmx,2022-09-18,2022-09-18,gmx-v1-perps__2022-09-18__e161f62a,parent#gmx
Grim Finance,12/18/21,Ecosystem,Flashloan Reentrancy Attack,30000000.0,Fantom,False,DeFi Protocol,,493.0,Solidity,https://twitter.com/RugDocIO/status/1472293717725913089,,2021-12-18,2021-12-18,grim-finance__2021-12-18__1cbeff6e,defillama#493
Treasure,3/3/22,Protocol Logic,Buy Function Exploit,1400000.0,Arbitrum,False,DeFi Protocol,,1350.0,Solidity,https://twitter.com/sniko_/status/1499202361180442627?s=20&t=PmAlFn3y2dhQSStkXyDCDA,,2022-03-03,2022-03-03,treasure__2022-03-03__5ebd8e9e,defillama#1350
Themis Protocol,6/27/23,Ecosystem,Flashloan Price Oracle Attack,370000.0,Arbitrum,False,DeFi Protocol,,3158.0,Solidity,https://twitter.com/peckshield/status/1673778002373509121,,2023-06-27,2023-06-27,themis-protocol__2023-06-27__4257819b,defillama#3158
Allbridge Core,4/2/23,Ecosystem,Flashloan Price Oracle Attack,650000.0,BSC,True,DeFi Protocol,,3944.0,,https://allbridge.medium.com/allbridge-core-updates-following-the-relaunch-9f7716eeb5da,parent#allbridge,2023-04-02,2023-04-02,allbridge-core__2023-04-02__b667790b,parent#allbridge
Kronos Research,11/18/23,Infrastructure,API Key unauthorized access,26000000.0,Ethereum,False,Other,,,,https://twitter.com/ResearchKronos/status/1726013733888041376,,2023-11-18,2023-11-18,kronos-research__2023-11-18__a9b92704,name#kronos-research
Curve DEX,7/30/23,Infrastructure,Vyper Compiler Bug,61700000.0,Ethereum,False,DeFi Protocol,,3.0,Vyper,https://twitter.com/spreekaway/status/1685669149911990273,parent#curve-finance,2023-07-30,2023-07-30,curve-dex__2023-07-30__0dd585f1,parent#curve-finance
Inverse Finance Frontier,4/2/22,Ecosystem,Price Oracle Attack,15600000.0,Ethereum,False,DeFi Protocol,,338.0,Solidity,https://twitter.com/FrankResearcher/status/1510239094777032713?s=20&t=RBNXo-6wEDCiBE5a9nO0-Q,parent#inverse-finance,2022-04-02,2022-04-02,inverse-finance-frontier__2022-04-02__03901bd7,parent#inverse-finance
Harbor Protocol,8/19/23,,,,Comdex,False,DeFi Protocol,,2388.0,Rust,https://twitter.com/PeckShieldAlert/status/1692852140199522716,,2023-08-19,2023-08-19,harbor-protocol__2023-08-19__cf60614b,defillama#2388
Sturdy V1,6/12/23,Ecosystem,Flashloan Reentrancy Attack,770000.0,Ethereum,False,DeFi Protocol,,1577.0,Solidity,https://twitter.com/blocksecteam/status/1668084629654638592,parent#sturdy,2023-06-12,2023-06-12,sturdy-v1__2023-06-12__faefd498,parent#sturdy
Heco Bridge,11/22/23,Infrastructure,Private Key Compromised (Unknown Method),86600000.0,Ethereum,True,DeFi Protocol,,,,https://twitter.com/TheBlock__/status/1727397707843621201,,2023-11-22,2023-11-22,heco-bridge__2023-11-22__8e78cba7,name#heco-bridge
Wise Lending V1,1/12/24,Protocol Logic,Rounding Donation Attack,464000.0,Ethereum,False,DeFi Protocol,,3491.0,Solidity,https://twitter.com/spreekaway/status/1745892488127070270,parent#wise-lending,2024-01-12,2024-01-12,wise-lending-v1__2024-01-12__2ad31d68,parent#wise-lending
Lendf.me,4/19/20,Smart Contract Language,Reentrancy,1200000.0,Ethereum,False,DeFi Protocol,,,Solidity,https://slowmist.medium.com/slowmist-details-of-lendf-me-reentrancy-attack-3e168ab5f2b1,,2020-04-19,2020-04-19,lendf-me__2020-04-19__60dc8eb9,name#lendf-me
ForceBridge,6/6/25,Protocol Logic,Acces Control Exploit,3900000.0,Nervos,True,DeFi Protocol,,,Rust,https://x.com/hackenclub/status/1929451310060892202,,2025-06-06,2025-06-06,forcebridge__2025-06-06__0b12e83e,name#forcebridge
BtcTurk,8/14/25,Infrastructure,Private Key Compromised,48000000.0,"Ethereum,Avalanche,Arbitrum,Base,Optimism,Mantle,Polygon",False,CEX,,,Solidity,https://x.com/CyversAlerts/status/1955967877602803929,,2025-08-14,2025-08-14,btcturk__2025-08-14__e82cb4aa,name#btcturk
ElasticSwap,12/13/22,Ecosystem,Price Oracle Attack,854000.0,"Avalanche,Ethereum",False,DeFi Protocol,520650.0,1919.0,,https://twitter.com/ElasticSwap/status/1602582495819694081,,2022-12-13,2022-12-13,elasticswap__2022-12-13__ff8995b0,defillama#1919
Onyx Protocol,11/1/23,Ecosystem,Flashloan Donate Function Logic Exploit,2100000.0,Ethereum,False,DeFi Protocol,,1631.0,Solidity,https://twitter.com/decurityhq/status/1719657969925677161,parent#onyx,2023-11-01,2023-11-01,onyx-protocol__2023-11-01__4dcb3e3d,parent#onyx
Magpie Protocol,4/23/24,Protocol Logic,Router Exploit,129000.0,"Ethereum,Polygon,BSC,Blast,Avalanche,Arbitrum,Optimism,Base,zkSync Era,Polygon zkEVM",False,DeFi Protocol,,,Solidity,https://twitter.com/magpieprotocol/status/1782708631126819137,,2024-04-23,2024-04-23,magpie-protocol__2024-04-23__f0cbb220,name#magpie-protocol
Hundred Finance,4/15/23,Protocol Logic,Flashloan Donate Function Logic Exploit,7000000.0,Optimism,False,DeFi Protocol,,607.0,Solidity,https://rekt.news/hundred-rekt2/,,2023-04-15,2023-04-15,hundred-finance__2023-04-15__9da00f9a,defillama#607
Hope Finance,2/20/23,Rugpull,Router Exploit,1860000.0,Arbitrum,False,DeFi Protocol,,,Solidity,https://twitter.com/Cointelegraph/status/1627976451814490113,,2023-02-20,2023-02-20,hope-finance__2023-02-20__4924ba2f,name#hope-finance
LuBian,12/28/20,Infrastructure,Private Key Compromised (Brute Force),3500000000.0,Bitcoin,False,Other,,,,https://x.com/arkham/status/1951729790299394113,,2020-12-28,2020-12-28,lubian__2020-12-28__b5a373cd,name#lubian
Mirror,10/8/21,Infrastructure,Outdated Oracle Exploit,2000000.0,Terra,False,DeFi Protocol,,260.0,Rust,https://twitter.com/FatManTerra/status/1531365988809293825?s=20&t=o8YSLZ0o7gAdHOxdVeuPcg,,2021-10-08,2021-10-08,mirror__2021-10-08__4cfe4e10,defillama#260
Ionic Protocol,2/4/25,Protocol Logic,Fake Collateral Exploit,4000000.0,Mode,False,DeFi Protocol,,4070.0,Solidity,https://x.com/CyversAlerts/status/1886829735130407065,,2025-02-04,2025-02-04,ionic-protocol__2025-02-04__c107236c,defillama#4070
Yearn Finance,2/5/21,Ecosystem,Flashloan Price Oracle Attack,11000000.0,Ethereum,False,DeFi Protocol,,113.0,Solidity,https://rekt.news/yearn-rekt/,parent#yearn,2021-02-05,2021-02-05,yearn-finance__2021-02-05__67bc2f75,parent#yearn
Florence Finance,11/30/23,Infrastructure,Address Poisoning,1450000.0,Ethereum,False,DeFi Protocol,,3197.0,Solidity,https://twitter.com/PeckShieldAlert/status/1730045158509727968,,2023-11-30,2023-11-30,florence-finance__2023-11-30__f3d98dee,defillama#3197
Rari Capital,5/8/21,Protocol Logic,Price Oracle Attack,10000000.0,Ethereum,False,DeFi Protocol,,136.0,Solidity,https://twitter.com/FrankResearcher/status/1391087260125188099,,2021-05-08,2021-05-08,rari-capital__2021-05-08__6e074ec9,defillama#136
dForce,4/19/20,Protocol Logic,Reentrancy,25000000.0,Ethereum,False,DeFi Protocol,,123.0,,https://decrypt.co/26033/dforce-lendfme-defi-hack-25m,,2020-04-19,2020-04-19,dforce__2020-04-19__2eaac0f7,defillama#123
Zabu Finance,9/12/21,Protocol Logic,Flashloan Exploit,3200000.0,Avalanche,False,DeFi Protocol,,,Solidity,https://www.immunebytes.com/blog/zabu-finance-hack-sep-12-2021-detailed-analysis-report/,,2021-09-12,2021-09-12,zabu-finance__2021-09-12__c41e2c89,name#zabu-finance
Magnate Finance,8/25/23,Rugpull,Drained Contracts,6400000.0,Base,False,DeFi Protocol,,3342.0,Solidity,https://twitter.com/PeckShieldAlert/status/1694946221788729440,,2023-08-25,2023-08-25,magnate-finance__2023-08-25__f52ba81e,defillama#3342
Sentiment,4/4/23,Ecosystem,Flashloan Reentrancy Attack,1000000.0,Arbitrum,False,DeFi Protocol,900000.0,2285.0,Solidity,https://twitter.com/spreekaway/status/1643314142214758410?t=Lsj87_GeYV3YDlVXX4bFHQ&s=19,,2023-04-04,2023-04-04,sentiment__2023-04-04__423ffd48,defillama#2285
CrediX,8/4/25,Infrastructure,Private Key Compromised,4500000.0,Sonic,False,DeFi Protocol,,,Solidity,https://x.com/CyversAlerts/status/1952299850650747079,,2025-08-04,2025-08-04,credix__2025-08-04__3cddb98b,name#credix
Bunny,7/16/21,Ecosystem,Flashloan Incentive Rewards Exploit,2400000.0,BSC,False,DeFi Protocol,,254.0,Solidity,https://pancakebunny.medium.com/polybunny-post-mortem-compensation-42b5c35ce957,,2021-07-16,2021-07-16,bunny__2021-07-16__d6aee060,defillama#254
StableMagnet,6/23/21,Rugpull,Drained Contracts and User Wallets,27000000.0,BSC,False,DeFi Protocol,,,Solidity,https://twitter.com/RugDocIO/status/1407830298251964427?s=20&t=ABcGHyHjFWrkOL8Ya2qfKQ,,2021-06-23,2021-06-23,stablemagnet__2021-06-23__74d3cd34,name#stablemagnet
Agave,3/15/22,Ecosystem,Flashloan Reentrancy Attack,5500000.0,Gnosis Chain,False,DeFi Protocol,,696.0,Solidity,https://rekt.news/agave-hundred-rekt/,,2022-03-15,2022-03-15,agave__2022-03-15__b028e17a,defillama#696
Atlantis Loans,6/10/23,Rugpull,Access Control Exploit,116000.0,BSC,False,DeFi Protocol,,745.0,Solidity,https://twitter.com/peckshield/status/1667624256111276033,,2023-06-10,2023-06-10,atlantis-loans__2023-06-10__ddf852d7,defillama#745
Bitrue,4/14/23,Infrastructure,Hot wallet hack,23000000.0,,False,CEX,,,,https://twitter.com/BTCTN/status/1646915702907973632,,2023-04-14,2023-04-14,bitrue__2023-04-14__1fbfb82a,name#bitrue
PRXVT,1/1/26,Protocol Logic,Sybil Attack with CREATE2 Addresses,97000.0,Base,False,DeFi Protocol,,,Solidity,https://x.com/CertiKAlert/status/2006653156927889666,,2026-01-01,2026-01-01,prxvt__2026-01-01__338f7ce7,name#prxvt
Meter,2/6/22,Protocol Logic,Deposit Function Exploit,7700000.0,Ethereum,True,DeFi Protocol,,,Solidity,https://twitter.com/ishwinder/status/1490227406824685569?s=20&t=_Ypi0s4w213ow0Rdgp4tmw,,2022-02-06,2022-02-06,meter__2022-02-06__e5c42ffd,name#meter
Punk Protocol,8/10/21,Smart Contract Language,Delegatecall Exploit,8950000.0,Ethereum,False,DeFi Protocol,,,Solidity,https://medium.com/punkprotocol/punk-finance-fair-launch-incident-report-984d9e340eb,,2021-08-10,2021-08-10,punk-protocol__2021-08-10__1da7227e,name#punk-protocol
Clipper,12/1/24,Protocol Logic,API Signature Exploit,450000.0,"Optimism,Base",False,DeFi Protocol,,622.0,,https://x.com/Clipper_DEX/status/1863263893470003460,,2024-12-01,2024-12-01,clipper__2024-12-01__5f01e669,defillama#622
Defrost,12/24/22,Rugpull,Oracle Manipulation,6000000.0,Avalanche,False,DeFi Protocol,6000000.0,913.0,Solidity,https://de.fi/blog/exclusive-the-defrost-team-rug-pulled-12m-7m-999b24c13f47,,2022-12-24,2022-12-24,defrost__2022-12-24__bd147779,defillama#913
Ambient,10/17/24,Ecosystem,Domain Hijack,,Ethereum,False,DeFi Protocol,,3104.0,,https://x.com/ambient_finance/status/1846895776116379747,,2024-10-17,2024-10-17,ambient__2024-10-17__6b8345df,defillama#3104
Raydium AMM,12/16/22,Infrastructure,Private Key Compromised (Unknown Method),4400000.0,Solana,False,DeFi Protocol,,214.0,Rust,https://twitter.com/osec_io/status/1603763023151509505?s=20&t=_J9Y8NV-o0QeXHtnkyR-4A,parent#raydium,2022-12-16,2022-12-16,raydium-amm__2022-12-16__ff6121f7,parent#raydium
Squid Games,11/3/21,Rugpull,Drained Liquidity Pool,3400000.0,BSC,False,Gaming,,,Solidity,https://x.com/__tricck/status/1455083308702834690,,2021-11-03,2021-11-03,squid-games__2021-11-03__1d55b2cb,name#squid-games
SuperRare,7/28/25,Protocol Logic,updateMerkleRoot Access Control Exploit,730000.0,Ethereum,False,DeFi Protocol,,3144.0,Solidity,https://x.com/CertiKAlert/status/1949772114309132363,,2025-07-28,2025-07-28,superrare__2025-07-28__551cca08,defillama#3144
DMM Bitcoin,5/31/24,Infrastructure,Private Key Compromised (Unknown Method),305000000.0,Bitcoin,False,CEX,305000000.0,,,https://x.com/Cointelegraph/status/1796544899606524310,,2024-05-31,2024-05-31,dmm-bitcoin__2024-05-31__a28ffeed,name#dmm-bitcoin
ValueDefi,11/14/20,Ecosystem,Flashloan Price Oracle Attack,7000000.0,Ethereum,False,DeFi Protocol,,164.0,Solidity,https://rekt.news/value-defi-rekt/,parent#value-finance,2020-11-14,2020-11-14,valuedefi__2020-11-14__73c7eb42,parent#value-finance
Shido,2/29/24,Protocol Logic,Private Key Compromised,3300000.0,Ethereum,False,Other,,,Solidity,https://cointelegraph.com/news/shido-token-plummet-attacker-drains-staking-contract,,2024-02-29,2024-02-29,shido__2024-02-29__ea09c77c,name#shido
Dexodus Finance,5/26/25,Protocol Logic,Price Manipulation Attack,300000.0,Base,False,DeFi Protocol,300000.0,5428.0,Solidity,https://x.com/hklst4r/status/1927008251045929463,,2025-05-26,2025-05-26,dexodus-finance__2025-05-26__41ec2b9b,defillama#5428
Panoptic V1.1,8/25/25,Protocol Logic,,0.0,"Base,Unichain,Ethereum",False,DeFi Protocol,,6230.0,Solidity,https://x.com/Panoptic_xyz/status/1964010635026715015,parent#panoptic,2025-08-25,2025-08-25,panoptic-v1-1__2025-08-25__2fbd0242,parent#panoptic
dYdX V3,11/18/23,Protocol Logic,Price Manipulation Attack,9000000.0,Ethereum,False,DeFi Protocol,,144.0,,https://twitter.com/AntonioMJuliano/status/1725926693440045389,parent#dydx,2023-11-18,2023-11-18,dydx-v3__2023-11-18__6cbffb9b,parent#dydx
zkFinance,11/11/24,Protocol Logic,Oracle Misconfiguration Exploit,200000.0,zkSync Era,False,DeFi Protocol,,4798.0,,https://x.com/spreekaway/status/1856101815995011427,,2024-11-11,2024-11-11,zkfinance__2024-11-11__c19d9808,defillama#4798
xToken,8/29/21,Ecosystem,Flashloan Price Oracle Attack,4500000.0,Ethereum,False,DeFi Protocol,,206.0,Solidity,https://medium.com/xtoken/xsnx-post-mortem-666d35071f38,,2021-08-29,2021-08-29,xtoken__2021-08-29__a89a5b92,defillama#206
Typus Perp,10/15/25,Protocol Logic,TLP Contract Exploit,3400000.0,Sui,False,DeFi Protocol,,6014.0,Move,https://x.com/TypusFinance/status/1978465485395304778,parent#typus-finance,2025-10-15,2025-10-15,typus-perp__2025-10-15__bd3266ab,parent#typus-finance
Garden,10/30/25,Protocol Logic,Private Key Compromised,10800000.0,"Ethereum,Arbitrum,Base,Solana",True,DeFi Protocol,,4086.0,,https://x.com/QuillAudits_AI/status/1983910001350783316,,2025-10-30,2025-10-30,garden__2025-10-30__1f8f4190,defillama#4086
Roe Finance,1/11/23,Ecosystem,Flashloan Pool Shares Exploit,80000.0,"Ethereum,Polygon",False,DeFi Protocol,,2357.0,,https://twitter.com/spreekaway/status/1613205435762495488,,2023-01-11,2023-01-11,roe-finance__2023-01-11__c85f1adf,defillama#2357
Gamma,1/4/24,Protocol Logic,Price Manipulation Attack,4500000.0,Arbitrum,False,DeFi Protocol,,355.0,Solidity,https://twitter.com/peckshieldalert/status/1742753372334399513,,2024-01-04,2024-01-04,gamma__2024-01-04__84a3a6a2,defillama#355
Ronin Bridge,8/6/24,Protocol Logic,MEV bot manipulation exploit,12000000.0,Ethereum,True,DeFi Protocol,,4440.0,Solidity,https://x.com/Ronin_Network/status/1820804772917588339,,2024-08-06,2024-08-06,ronin-bridge__2024-08-06__89792bd0,defillama#4440
Omm,1/21/23,Protocol Logic,Redeem Function Exploit,1891000.0,Icon,False,DeFi Protocol,,546.0,Java,https://forum.omm.finance/t/omm-exploit-postmortem-january-2023/266,,2023-01-21,2023-01-21,omm__2023-01-21__a633cc7b,defillama#546
uniBTC,9/26/24,Protocol Logic,Minting Logic Exploit,1700000.0,Ethereum,False,DeFi Protocol,,4966.0,Solidity,https://x.com/phtevenstrong/status/1839389432975397017,,2024-09-26,2024-09-26,unibtc__2024-09-26__823040f2,defillama#4966
KiloEx,4/14/25,Protocol Logic,Price Oracle Manipulation,7500000.0,"BSC,Base,Taiko",False,DeFi Protocol,6750000.0,3329.0,Solidity,https://x.com/shoucccc/status/1911862514440376446,,2025-04-14,2025-04-14,kiloex__2025-04-14__1d64244a,defillama#3329
Clober Liquidity Vault,12/10/24,Protocol Logic,Reentrancy,500000.0,Base,False,DeFi Protocol,,5315.0,,https://x.com/peckshieldalert/status/1866434326596112705,parent#clober,2024-12-10,2024-12-10,clober-liquidity-vault__2024-12-10__bd8e0932,parent#clober
Badger DAO,12/2/21,Infrastructure,Cloudflare Key Compromised,120000000.0,Ethereum,False,DeFi Protocol,,173.0,,https://badger.com/technical-post-mortem,,2021-12-02,2021-12-02,badger-dao__2021-12-02__1136e5a1,defillama#173
Convergence,8/1/24,Protocol Logic,Missing Input Validation,210000.0,Ethereum,False,DeFi Protocol,,,Solidity,https://www.coindesk.com/markets/2024/08/01/defi-protocol-convergence-hacked-cvg-token-plunges-99-on-curve/,,2024-08-01,2024-08-01,convergence__2024-08-01__658a2c51,name#convergence
Raga Finance,11/22/25,Infrastructure,HyperEVM Delta Neutral Exploit,18500.0,Hyperliquid L1,False,DeFi Protocol,,,Solidity,https://x.com/ragafinance/status/1994384974049591647,,2025-11-22,2025-11-22,raga-finance__2025-11-22__d58eb138,name#raga-finance
DuelBits,2/13/24,Infrastructure,Private Key Compromised,4600000.0,Ethereum,False,CEX,,,,https://x.com/CertiKAlert/status/1757681640384381238,,2024-02-13,2024-02-13,duelbits__2024-02-13__7e8cf348,name#duelbits
Wintermute,6/5/22,Infrastructure,Cross Chain Multisig Deployment Exploit,27600000.0,Optimism,False,DeFi Protocol,,,,https://banteg.mirror.xyz/iZAsBNL3j_5NIAY2Erav1r7Q4ecc7SC76AfMjyScs34,,2022-06-05,2022-06-05,wintermute__2022-06-05__1236ef66,name#wintermute
SharedStake,9/1/23,Protocol Logic,Ownership Override Attack,175000.0,Ethereum,False,DeFi Protocol,,275.0,,https://twitter.com/spreekaway/status/1697612239929246022,,2023-09-01,2023-09-01,sharedstake__2023-09-01__adf8b3ee,defillama#275
Mars Perps,12/14/25,Protocol Logic,Thin-Market Skew Exploit,960000.0,Neutron,False,DeFi Protocol,,5498.0,Rust,https://x.com/mars_protocol/status/2000283619361800307,parent#mars-protocol,2025-12-14,2025-12-14,mars-perps__2025-12-14__8bdd91d8,parent#mars-protocol
Vestra DAO,12/4/24,Protocol Logic,Staking Logic Exploit,500000.0,Ethereum,False,DeFi Protocol,,,Solidity,https://x.com/_czepluch/status/1866112404242743590,,2024-12-04,2024-12-04,vestra-dao__2024-12-04__316a1b33,name#vestra-dao
Indexed Finance,10/14/21,Ecosystem,Flashloan Price Oracle Attack,16000000.0,Ethereum,False,DeFi Protocol,,188.0,Solidity,https://ndxfi.medium.com/indexed-attack-post-mortem-b006094f0bdc,,2021-10-14,2021-10-14,indexed-finance__2021-10-14__6cd4a687,defillama#188
Remitano,9/15/23,Infrastructure,Private Key Compromised (Unknown Method),2700000.0,"Ethereum,Tron,BitcoinCash",False,CEX,,,,https://twitter.com/CyversAlerts/status/1702348063145165016/photo/1,,2023-09-15,2023-09-15,remitano__2023-09-15__5b1db45a,name#remitano
PeopleDAO,3/8/23,Infrastructure,Social Engineering,120000.0,Ethereum,False,DAO,,,,https://twitter.com/The_PeopleDAO/status/1634518915668668416?s=20,,2023-03-08,2023-03-08,peopledao__2023-03-08__9f9605f9,name#peopledao
Midas Capital,6/17/23,Protocol Logic,Redeem Rounding Error Exploit,600000.0,BSC,False,DeFi Protocol,,1925.0,Solidity,https://twitter.com/peckshield/status/1670148905810403330?s=20,,2023-06-17,2023-06-17,midas-capital__2023-06-17__74402645,defillama#1925
pNetwork,10/4/21,Protocol Logic,Log Spoofing,13000000.0,"BSC,Bitcoin",True,DeFi Protocol,,,Rust,https://www.halborn.com/blog/post/explained-the-pnetwork-hack-september-2021,,2021-10-04,2021-10-04,pnetwork__2021-10-04__cdf42824,name#pnetwork
Evoq Finance,9/10/25,Infrastructure,Advanced Persistent Threat (APT) attack,420000.0,BSC,False,DeFi Protocol,,5959.0,Solidity,https://x.com/Evoq_Finance/status/1965691948939014408,,2025-09-10,2025-09-10,evoq-finance__2025-09-10__3ee16afc,defillama#5959
Ribbon,12/12/25,Protocol Logic,Private Key Compromised,2700000.0,Ethereum,False,DeFi Protocol,,281.0,Solidity,https://x.com/specteranalyst/status/1999532982411854109,parent#ribbon-finance,2025-12-12,2025-12-12,ribbon__2025-12-12__c1db2803,parent#ribbon-finance
KuCoin,9/29/20,Infrastructure,Private Key Compromised (Unknown Method),45000000.0,Ethereum,False,CEX,,2274.0,,https://rekt.news/epic-hack-homie/,,2020-09-29,2020-09-29,kucoin__2020-09-29__da13321a,defillama#2274
ETHTrustFund,7/22/24,Rugpull,Transferred Treasury to Mixers,2100000.0,Base,False,DeFi Protocol,,,Solidity,https://cointelegraph.com/news/ethtrustfund-dao-transfers-treasury-apparent-rug-pull,,2024-07-22,2024-07-22,ethtrustfund__2024-07-22__6d2ab3bd,name#ethtrustfund
Berally,3/14/25,Infrastructure,Private Key Compromised (Unknown Method),90000.0,Berachain,False,DeFi Protocol,,,Solidity,https://x.com/Berally_io/status/1900732333562744870,,2025-03-14,2025-03-14,berally__2025-03-14__4df539c6,name#berally
Unibot,10/31/23,Protocol Logic,Token approval exploit,640000.0,Ethereum,False,DeFi Protocol,,3106.0,Solidity,https://twitter.com/peckshield/status/1719223437024284978,,2023-10-31,2023-10-31,unibot__2023-10-31__8d4734e1,defillama#3106
Cork V1,5/28/25,Protocol Logic,Access control bypass via hook,12000000.0,Ethereum,False,DeFi Protocol,,6262.0,Solidity,https://x.com/CyversAlerts/status/1927701403092316254,,2025-05-28,2025-05-28,cork-v1__2025-05-28__47e14d0f,defillama#6262
Safemoon,3/28/23,Protocol Logic,Access Control Exploit,8900000.0,BSC,False,DeFi Protocol,,,Solidity,https://twitter.com/MoonMark_/status/1640844732082290688?s=20,,2023-03-28,2023-03-28,safemoon__2023-03-28__bbaa3d08,name#safemoon
PolyNetwork,8/12/24,Protocol Logic,Reentrancy,5000000.0,PolyNetwork,True,DeFi Protocol,,,Solidity,https://medium.com/flamingo-finance/poly-network-bridge-exploit-and-the-asset-support-initiative-c80c636255bb,,2024-08-12,2024-08-12,polynetwork__2024-08-12__123125bb,name#polynetwork
FTX,11/12/22,Infrastructure,Private Key Compromised (Unknown Method),450000000.0,"Ethereum,Solana",False,CEX,,,,https://twitter.com/zachxbt/status/1591475246250733568?s=20&t=jbwCEhQZKfWFnLPtCwErAg,,2022-11-12,2022-11-12,ftx__2022-11-12__7ca58385,name#ftx
OKX NFT Aggregator,6/20/24,Protocol Logic,Access Control Exploit,14000.0,BSC,False,CEX,,,Solidity,https://x.com/shoucccc/status/1803973429345030381,,2024-06-20,2024-06-20,okx-nft-aggregator__2024-06-20__dd98bfa8,name#okx-nft-aggregator
KyberSwap Elastic,11/22/23,Protocol Logic,Flashloan Swap Logic Exploit,48000000.0,"Ethereum,Base,Polygon,Optimism,Arbitrum",False,DeFi Protocol,,2615.0,Solidity,https://twitter.com/KyberNetwork/status/1727475235342217682,parent#kyberswap,2023-11-22,2023-11-22,kyberswap-elastic__2023-11-22__6ad21176,parent#kyberswap
Zunami Protocol,8/13/23,Ecosystem,Price Manipulation Attack,2100000.0,Ethereum,False,DeFi Protocol,,1201.0,Solidity,https://twitter.com/decryptmedia/status/1690946389323157504,,2023-08-13,2023-08-13,zunami-protocol__2023-08-13__560a4dfd,defillama#1201
Balancer V2,11/3/25,Protocol Logic,Composable Stable Pools Exploit,128000000.0,"Ethereum,Arbitrum,Base,Polygon,Sonic,Optimism",False,DeFi Protocol,,2611.0,Solidity,https://x.com/lookonchain/status/1985258890863501820,parent#balancer,2025-11-03,2025-11-03,balancer-v2__2025-11-03__531ff685,parent#balancer
Rodeo,7/4/23,Protocol Logic,Mint Reserves Logic Exploit,90000.0,Arbitrum,False,DeFi Protocol,,2841.0,Solidity,https://twitter.com/Phalcon_xyz/status/1676511696603729921?s=20,,2023-07-04,2023-07-04,rodeo__2023-07-04__5b524aee,defillama#2841
Coincheck,1/26/18,Infrastructure,Private Key Compromised (Unknown Method),534000000.0,NEM,False,CEX,,,,https://www.bbc.com/news/world-asia-42845505,,2018-01-26,2018-01-26,coincheck__2018-01-26__587c1a62,name#coincheck
Parity Multisig,11/9/17,Protocol Logic,Contract not initialized,150000000.0,Ethereum,False,DeFi Protocol,,,Solidity,https://blog.openzeppelin.com/on-the-parity-wallet-multisig-hack-405a8c12e8f7,,2017-11-09,2017-11-09,parity-multisig__2017-11-09__fc3f5acf,name#parity-multisig
Local Traders,5/24/23,Protocol Logic,Access Control Exploit,118000.0,BSC,False,DeFi Protocol,,,Solidity,https://twitter.com/BeosinAlert/status/1661210668291489794,,2023-05-24,2023-05-24,local-traders__2023-05-24__883b1d7f,name#local-traders
Sonne Finance,5/15/24,Ecosystem,Flashloan Donate Function Logic Exploit,20000000.0,Optimism,False,DeFi Protocol,,2142.0,Solidity,https://medium.com/@SonneFinance/post-mortem-sonne-finance-exploit-12f3daa82b06,,2024-05-15,2024-05-15,sonne-finance__2024-05-15__dba3173b,defillama#2142
Atomic Wallet,6/3/23,Infrastructure,Private Key Compromised (Unknown Method),100000000.0,"Ethereum,Tron,BSC,Bitcoin,Polkadot,Avalanche",False,Wallet,,,,https://twitter.com/tayvano_/status/1668778031790587905?t=ZXAVt7ExhHZcGIzs5ZD33w&s=19,,2023-06-03,2023-06-03,atomic-wallet__2023-06-03__bde9a7bb,name#atomic-wallet
AscenDEX,12/11/21,Infrastructure,Private Key Compromised,77000000.0,"Ethereum,BSC,Polygon",False,CEX,,,,https://rekt.news/ascendex-rekt/,,2021-12-11,2021-12-11,ascendex__2021-12-11__90f3dcec,name#ascendex
Spectral Labs,12/1/24,Protocol Logic,Bonding Curve Exploit,200000.0,Ethereum,False,DeFi Protocol,,,,https://x.com/Spectral_Labs/status/1863212410070253824,,2024-12-01,2024-12-01,spectral-labs__2024-12-01__c62e3479,name#spectral-labs
Moonwell Lending,11/4/25,Protocol Logic,Oracle Price Feed Manipulation,1000000.0,"Base,Optimism",False,DeFi Protocol,,1853.0,Solidity,https://x.com/getfailsafe/status/1985628261913919702,parent#moonwell,2025-11-04,2025-11-04,moonwell-lending__2025-11-04__74890e8e,parent#moonwell
Hundred Finance,3/15/22,Ecosystem,Flashloan Reentrancy Attack,6200000.0,Gnosis Chain,False,DeFi Protocol,,607.0,Solidity,https://rekt.news/agave-hundred-rekt/,,2022-03-15,2022-03-15,hundred-finance__2022-03-15__ce6a11ab,defillama#607
Ankr,12/2/22,Protocol Logic,Access Control Exploit,5000000.0,BSC,False,DeFi Protocol,5000000.0,278.0,Solidity,https://twitter.com/ankr/status/1598503332477280256,,2022-12-02,2022-12-02,ankr__2022-12-02__d205cae8,defillama#278
CREAM Lending,8/30/21,Ecosystem,Flashloan Reentrancy Attack,18800000.0,Ethereum,False,DeFi Protocol,,121.0,Solidity,https://twitter.com/peckshield/status/1432249600002478081,parent#cream-finance,2021-08-30,2021-08-30,cream-lending__2021-08-30__c68b9ec7,parent#cream-finance
Deribit,11/1/22,Infrastructure,Private Key Compromised (Unknown Method),28000000.0,,False,CEX,,2273.0,,https://twitter.com/DeribitExchange/status/1587701883778523136,,2022-11-01,2022-11-01,deribit__2022-11-01__9c3cf98f,defillama#2273
DeltaPrime,11/11/24,Protocol Logic,Debt Swap Exploit,4800000.0,"Arbitrum,Avalanche",False,DeFi Protocol,,2479.0,Solidity,https://x.com/peckshield/status/1855900790063607929,,2024-11-11,2024-11-11,deltaprime__2024-11-11__4c605106,defillama#2479
Shibarium,9/13/25,Protocol Logic,Validator Stake Manipulation by Flashloan,3000000.0,Shibarium,True,DeFi Protocol,,,Solidity,https://x.com/0xZilayo/status/1966785029968724351,,2025-09-13,2025-09-13,shibarium__2025-09-13__2078cc8a,name#shibarium
Kokomo Finance,3/27/23,Rugpull,Drained Contracts,4000000.0,Optimism,False,DeFi Protocol,,,Solidity,https://x.com/CertiKAlert/status/1640118618548568069,,2023-03-27,2023-03-27,kokomo-finance__2023-03-27__c120fcc0,name#kokomo-finance
DEXX,11/16/24,Infrastructure,Private Key Compromised (Stored Publicly),21000000.0,Solana,False,Wallet,,,,https://x.com/DEXXai_EN/status/1857830993656418763,,2024-11-16,2024-11-16,dexx__2024-11-16__67f07d6a,name#dexx
WOOFi Swap,3/5/24,Protocol Logic,Price Oracle Manipulation,8500000.0,Arbitrum,False,DeFi Protocol,,1461.0,Solidity,https://twitter.com/peckshieldalert/status/1765054155478175943,parent#woofi,2024-03-05,2024-03-05,woofi-swap__2024-03-05__e54bc5a9,parent#woofi
PrismaLST,3/28/24,Protocol Logic,Flashloan Trove Manipulation,11600000.0,Ethereum,False,DeFi Protocol,,3473.0,Solidity,https://twitter.com/PeckShieldAlert/status/1773345454832378109,parent#prisma,2024-03-28,2024-03-28,prismalst__2024-03-28__6df15a66,parent#prisma
Trinity Wallet,2/12/20,Infrastructure,Cloudflare Key Compromised,2350000.0,Iota,False,Wallet,,,,https://blog.iota.org/trinity-attack-incident-part-1-summary-and-next-steps-8c7ccc4d81e8/,,2020-02-12,2020-02-12,trinity-wallet__2020-02-12__3ca034ba,name#trinity-wallet
Bittensor,7/2/24,Infrastructure,Private Key Compromised (Supply Chain Attack),8000000.0,,False,DeFi Protocol,,4547.0,Python,https://x.com/vishal4c/status/1808332836484927677,,2024-07-02,2024-07-02,bittensor__2024-07-02__50e9d302,defillama#4547
Abracadabra Spell,3/25/25,Protocol Logic,,13000000.0,Arbitrum,False,DeFi Protocol,,347.0,Solidity,https://x.com/peckshield/status/1904501599848038490,parent#abracadabra,2025-03-25,2025-03-25,abracadabra-spell__2025-03-25__3ee0abc5,parent#abracadabra
Bitmart,12/4/21,Infrastructure,Private Key Compromised (Unknown Method),196000000.0,"Ethereum,BSC",False,CEX,,,,https://rekt.news/bitmart-rekt/,,2021-12-04,2021-12-04,bitmart__2021-12-04__93ab793c,name#bitmart
LendHub,1/16/23,Protocol Logic,Collateral Offboarding Mistake,6000000.0,Heco,False,DeFi Protocol,,380.0,Solidity,https://twitter.com/SlowMist_Team/status/1613906590574198784?s=20,,2023-01-16,2023-01-16,lendhub__2023-01-16__62ca05a1,defillama#380
Paid Network,3/5/21,Rugpull,Infinite Mint and Dump,27000000.0,Ethereum,False,DeFi Protocol,,,,https://rekt.news/paid-rekt/,,2021-03-05,2021-03-05,paid-network__2021-03-05__f907c87d,name#paid-network
Compound V2,9/29/21,Protocol Logic,Math Mistake Exploit,147000000.0,Ethereum,False,DeFi Protocol,,114.0,Solidity,https://rekt.news/compound-rekt/,parent#compound-finance,2021-09-29,2021-09-29,compound-v2__2021-09-29__e785bdc6,parent#compound-finance
Coinbase,8/13/25,Ecosystem,MEV composability attack,300000.0,Ethereum,False,CEX,,,Solidity,https://x.com/deeberiroz/status/1955718986894549344,,2025-08-13,2025-08-13,coinbase__2025-08-13__d7bb3238,name#coinbase
Terra 2.0,7/31/24,Infrastructure,IBC hooks exploit,5000000.0,Terra2,False,DeFi Protocol,,,Golang,https://medium.com/@Rarma_/terra-ibc-hooks-exploit-21cca87d70a4,,2024-07-31,2024-07-31,terra-2-0__2024-07-31__334a149d,name#terra-2-0
Bungee,1/16/24,Protocol Logic,Missing Input Validation,3300000.0,Ethereum,True,DeFi Protocol,,,Solidity,https://www.dlnews.com/articles/defi/hacker-swipes-33m-from-bungee-crypto-bridge-users/,,2024-01-16,2024-01-16,bungee__2024-01-16__aba14dce,name#bungee
Seneca,2/28/24,Protocol Logic,Token approval exploit,6500000.0,"Ethereum,Arbitrum",False,DeFi Protocol,,4137.0,Solidity,https://twitter.com/spreekaway/status/1762857769714012217,,2024-02-28,2024-02-28,seneca__2024-02-28__84481547,defillama#4137
Ola Finance,3/31/22,Smart Contract Language,Reentrancy,4000000.0,Fuse,False,DeFi Protocol,,,Solidity,https://www.coindesk.com/tech/2022/03/31/ola-finance-exploited-for-36m-in-re-entrancy-attack/,,2022-03-31,2022-03-31,ola-finance__2022-03-31__c4d521ed,name#ola-finance
Hector Lending,6/2/23,Protocol Logic,Unknown,653000.0,Fantom,True,DeFi Protocol,,2761.0,,https://twitter.com/Hector_Network/status/1664720154595414019,parent#hector-network,2023-06-02,2023-06-02,hector-lending__2023-06-02__ec0ff476,parent#hector-network
numa.,8/10/25,Protocol Logic,NumaVault Exploit,320000.0,Sonic,False,DeFi Protocol,,,Solidity,https://x.com/CertiKAlert/status/1954758545859375266,,2025-08-10,2025-08-10,numa__2025-08-10__bee21b2d,name#numa
Sharwa.Finance,10/20/25,Protocol Logic,Price Manipulation Attack,146000.0,Arbitrum,False,DeFi Protocol,,6876.0,Solidity,https://x.com/hklst4r/status/1980157251550670992,,2025-10-20,2025-10-20,sharwa-finance__2025-10-20__948fc222,defillama#6876
Meerkat Finance,3/4/21,Rugpull,Drained Contracts,32000000.0,BSC,False,DeFi Protocol,,,Solidity,https://rekt.news/meerkat-finance-bsc-rekt/,,2021-03-04,2021-03-04,meerkat-finance__2021-03-04__ab2b346e,name#meerkat-finance
GeniusAI,5/5/24,Infrastructure,Private Key Compromised (Discord Hack),1270000.0,"Fantom,Ethereum",False,DeFi Protocol,,,Solidity,https://cointelegraph.com/news/gnus-discord-hack-causes-1-27-million-losses,,2024-05-05,2024-05-05,geniusai__2024-05-05__7eb8284a,name#geniusai
Fegex,12/29/24,Protocol Logic,Missing Access Control,900000.0,"Ethereum,BSC,Base",False,DeFi Protocol,,672.0,Solidity,https://x.com/Phalcon_xyz/status/1873634026444968034,,2024-12-29,2024-12-29,fegex__2024-12-29__7e46fd3b,defillama#672
Merlin,6/29/21,Protocol Logic,Incentive Rewards Exploit,330000.0,BSC,False,DeFi Protocol,,370.0,Solidity,https://rekt.news/merlin3-rekt/,,2021-06-29,2021-06-29,merlin__2021-06-29__5d9eef6a,defillama#370
Bondly,7/15/21,Infrastructure,Private Key Compromised (Unknown Method),5900000.0,Ethereum,False,DeFi Protocol,,,Solidity,https://rekt.news/bondly-rekt/,,2021-07-15,2021-07-15,bondly__2021-07-15__92f73890,name#bondly
Velocore V2,6/2/24,Protocol Logic,Fee Overflow Exploit,6800000.0,"Linea,zkSync Era",False,DeFi Protocol,,3330.0,Solidity,https://x.com/velocorexyz/status/1797229772399067587,parent#velocore,2024-06-02,2024-06-02,velocore-v2__2024-06-02__ec3f3ec5,parent#velocore
Dragoma,8/8/22,Rugpull,Drain Vaults,3500000.0,Polygon,False,DeFi Protocol,,,,https://www.coindesk.com/business/2022/08/08/polygon-based-web3-game-dragoma-supporters-fall-victim-to-35m-rug-pull-peckshield/,,2022-08-08,2022-08-08,dragoma__2022-08-08__3aa1f09a,name#dragoma
UXLINK,9/22/25,Protocol Logic,Delegatecall Exploit,11300000.0,"Ethereum,Arbitrum",False,DeFi Protocol,,6040.0,Solidity,https://x.com/CyversAlerts/status/1970167036002132425,,2025-09-22,2025-09-22,uxlink__2025-09-22__18467c49,defillama#6040
Orbit Bridge,12/31/23,Protocol Logic,Signature Exploit,81700000.0,Ethereum,True,DeFi Protocol,,1981.0,Solidity,https://cointelegraph.com/news/cross-chain-protocol-orbit-bridge-suffers-exploit-hack,,2023-12-31,2023-12-31,orbit-bridge__2023-12-31__4f9fa29d,defillama#1981
Penpie,9/3/24,Protocol Logic,Reentrancy,27000000.0,Ethereum,False,DeFi Protocol,,3083.0,Solidity,https://x.com/shoucccc/status/1831044487323529639,parent#magpie-ecosystem,2024-09-03,2024-09-03,penpie__2024-09-03__a11c4d5c,parent#magpie-ecosystem
Nemo Yield Trading,9/8/25,Protocol Logic,Price Oracle Manipulation,2400000.0,Sui,False,DeFi Protocol,,6313.0,Move,https://x.com/CertiKAlert/status/1964942965098656034,parent#nemo,2025-09-08,2025-09-08,nemo-yield-trading__2025-09-08__88dd7806,parent#nemo
Alpha Finance,2/13/21,Ecosystem,Flashloan Pool Shares Exploit,37500000.0,Ethereum,False,DeFi Protocol,,,Solidity,https://blog.alphaventuredao.io/alpha-homora-v2-post-mortem/,,2021-02-13,2021-02-13,alpha-finance__2021-02-13__774c44f2,name#alpha-finance
Bitget,4/20/25,Infrastructure,Market-Making Bot Exploit,100000000.0,,False,CEX,,,,https://x.com/0xDamix/status/1913918706985623945,,2025-04-20,2025-04-20,bitget__2025-04-20__abcf8d9d,name#bitget
Yearn Finance,12/16/25,Protocol Logic,misconfigured Fulcrum sUSD strategy,300000.0,Ethereum,False,DeFi Protocol,,113.0,Solidity,https://x.com/peckshieldalert/status/2001080131360842011,parent#yearn,2025-12-16,2025-12-16,yearn-finance__2025-12-16__ce79fd6f,parent#yearn
CoinsPaid,7/22/23,Ecosystem,Social Engineering,37300000.0,,False,Other,,,,https://twitter.com/coinspaid/status/1684297537010774017,,2023-07-22,2023-07-22,coinspaid__2023-07-22__04fa025c,name#coinspaid
Merlin,5/26/21,Protocol Logic,Math Mistake Exploit,550000.0,BSC,False,DeFi Protocol,,370.0,Solidity,https://rekt.news/merlin2-rekt/,,2021-05-26,2021-05-26,merlin__2021-05-26__50a403ff,defillama#370
CoinDCX,7/19/25,Infrastructure,,44200000.0,,False,CEX,,4042.0,,https://x.com/CryptooIndia/status/1946596846052458548,,2025-07-19,2025-07-19,coindcx__2025-07-19__ad487fbb,defillama#4042
Rain,4/29/24,Infrastructure,,14800000.0,"Bitcoin,Ethereum,XRP,Solana",False,CEX,,,,https://twitter.com/CoinDesk/status/1790197230915194916,,2024-04-29,2024-04-29,rain__2024-04-29__db52e4e7,name#rain
US Government Crypto Wallet,10/24/24,,,20000000.0,Ethereum,False,Other,,,,https://x.com/decryptmedia/status/1849540098607415441,,2024-10-24,2024-10-24,us-government-crypto-wallet__2024-10-24__011e0a0f,name#us-government-crypto-wallet
Rubic,12/25/22,Protocol Logic,Router Exploit,1410000.0,Ethereum,True,DeFi Protocol,,1282.0,Solidity,https://twitter.com/peckshield/status/1606937055761952770?s=20&t=Vdvjv2C7zUazmgvQ2SOQow,,2022-12-25,2022-12-25,rubic__2022-12-25__4b30420b,defillama#1282
SwissBorg,9/9/25,Infrastructure,Third-party API compromise,41500000.0,Solana,False,CEX,,2295.0,,https://x.com/rishabhsrishi/status/1965115870042263828,,2025-09-09,2025-09-09,swissborg__2025-09-09__802e4e57,defillama#2295
Bitcoin Mission,4/22/25,Protocol Logic,overPaper Function Exploit,1300000.0,Arbitrum,False,DeFi Protocol,,,Solidity,https://x.com/officer_cia/status/1914690926695362685,,2025-04-22,2025-04-22,bitcoin-mission__2025-04-22__e2f1939b,name#bitcoin-mission
OKX DEX,12/13/23,Infrastructure,Private Key Compromised (Unknown Method),2700000.0,Ethereum,False,DeFi Protocol,,,Solidity,https://twitter.com/TheBlock__/status/1734921504523956630,,2023-12-13,2023-12-13,okx-dex__2023-12-13__5b944297,name#okx-dex
DEUS Finance,3/15/21,Ecosystem,Flashloan Price Oracle Attack,3000000.0,Fantom,False,DeFi Protocol,,1387.0,Solidity,https://twitter.com/peckshield/status/1503632734299701250,,2021-03-15,2021-03-15,deus-finance__2021-03-15__429184a0,defillama#1387
SurgeBNB,8/17/21,Ecosystem,Flashloan Reentrancy Attack,4000000.0,BSC,False,DeFi Protocol,,,Solidity,https://beosin.medium.com/a-sweet-blow-fb0a5e08657d,,2021-08-17,2021-08-17,surgebnb__2021-08-17__68721cb1,name#surgebnb
Unilend V2,1/12/25,Protocol Logic,Redeem Process Exploit,197600.0,Ethereum,False,DeFi Protocol,,4288.0,Solidity,https://www.the-blockchain.com/2025/01/13/unilend-finance-losses-197-6k-to-a-redeem-process-vulnerability-exploit/,parent#unilend,2025-01-12,2025-01-12,unilend-v2__2025-01-12__1f457a9a,parent#unilend
Cashio,3/23/22,Protocol Logic,Collateral Validation Exploit,48000000.0,Solana,False,DeFi Protocol,,793.0,Rust,https://twitter.com/samczsun/status/1506578902331768832?s=20&t=UL8INfwfJ5hgY7Vq9M3Sbw,,2022-03-23,2022-03-23,cashio__2022-03-23__f21a3a87,defillama#793
The DAO,6/17/16,Protocol Logic,Reentrancy,60000000.0,Ethereum,False,DeFi Protocol,,,Solidity,https://ogucluturk.medium.com/the-dao-hack-explained-unfortunate-take-off-of-smart-contracts-2bd8c8db3562,,2016-06-17,2016-06-17,the-dao__2016-06-17__ad1477bd,name#the-dao
Nirvana V1,7/28/22,Ecosystem,Flashloan Price Oracle Attack,3500000.0,Solana,False,DeFi Protocol,,1825.0,Rust,https://twitter.com/osec_io/status/1552589378719207424?s=20&t=I8QXz7iG0z7hjvfCA579LA,parent#nirvana,2022-07-28,2022-07-28,nirvana-v1__2022-07-28__0ec9c66c,parent#nirvana
BtcTurk,6/22/24,,Private Key Compromised (Unknown Method),54000000.0,,False,CEX,,,,https://x.com/wublockchain/status/1804487593062752260,,2024-06-22,2024-06-22,btcturk__2024-06-22__b5d35b9e,name#btcturk
Usual,5/27/25,Protocol Logic,Arbitration Exploit,43000.0,Ethereum,False,DeFi Protocol,,4882.0,Solidity,https://x.com/BlockSecTeam/status/1927601457815040283,,2025-05-27,2025-05-27,usual__2025-05-27__ada9ca02,defillama#4882
Paraluni Masterchef,3/13/22,Ecosystem,Flashloan Reentrancy Attack,1700000.0,BSC,False,DeFi Protocol,,1520.0,Solidity,https://slowmist.medium.com/paraluni-incident-analysis-58be442a4f99,parent#paraluni,2022-03-13,2022-03-13,paraluni-masterchef__2022-03-13__6b78a9ff,parent#paraluni
CoinDash,7/18/17,Protocol Logic,Frontend Attack,7700000.0,Ethereum,False,ICO,,,,https://www.coindesk.com/markets/2017/07/17/7-million-lost-in-coindash-ico-hack/,,2017-07-18,2017-07-18,coindash__2017-07-18__0dd469db,name#coindash
Cozy V2,8/30/25,Protocol Logic,Insufficient Sender Verification Exploit,427000.0,Optimism,False,DeFi Protocol,,2964.0,Solidity,https://x.com/DecurityHQ/status/1961810726164533602,parent#cozy-finance,2025-08-30,2025-08-30,cozy-v2__2025-08-30__318f0196,parent#cozy-finance
zkLend,2/11/25,Protocol Logic,Empty Market Exploit,9550000.0,Starknet,False,DeFi Protocol,,3079.0,Cairo,https://x.com/zkLend/status/1889515118368829559,parent#zklend-finance,2025-02-11,2025-02-11,zklend__2025-02-11__ab3ad635,parent#zklend-finance
Poly Network,8/10/21,Protocol Logic,Access Control Exploit,611000000.0,"Ethereum,BSC,Polygon",True,DeFi Protocol,,1796.0,Solidity,https://slowmist.medium.com/the-root-cause-of-poly-network-being-hacked-ec2ee1b0c68f,,2021-08-10,2021-08-10,poly-network__2021-08-10__14203db7,defillama#1796
XT Exchange,11/28/24,Infrastructure,,1700000.0,Ethereum,False,CEX,,,,https://x.com/protos/status/1862100763570294837,,2024-11-28,2024-11-28,xt-exchange__2024-11-28__bde0d440,name#xt-exchange
Rho Markets,7/19/24,Protocol Logic,Price Oracle Manipulation,7600000.0,Scroll,False,DeFi Protocol,,4808.0,Solidity,https://x.com/DLNewsInfo/status/1814302008213410292,,2024-07-19,2024-07-19,rho-markets__2024-07-19__319fc899,defillama#4808
GriffinAI,9/24/25,Infrastructure,False Peer Exploit,3000000.0,BSC,False,DeFi Protocol,,,Solidity,https://x.com/CertiKAlert/status/1971053766540657069,,2025-09-24,2025-09-24,griffinai__2025-09-24__187f1a58,name#griffinai
Turtle Dex,3/20/21,Rugpull,Drained Contracts,2500000.0,BSC,False,DeFi Protocol,,,Solidity,https://cointelegraph.com/news/binance-smart-chain-s-turtledex-rugpulls-shortly-after-launch,,2021-03-20,2021-03-20,turtle-dex__2021-03-20__5e469328,name#turtle-dex
Gate,4/21/18,Infrastructure,Private Key Compromised (Unknown Method),235000000.0,,False,CEX,,2314.0,,https://www.justice.gov/opa/press-release/file/1253491/download,,2018-04-21,2018-04-21,gate__2018-04-21__6971cc62,defillama#2314
Monoswap,7/31/24,Infrastructure,Private Key Compromised (Malware),1300000.0,Blast,False,DeFi Protocol,,,Solidity,https://x.com/monoswapio/status/1816151998267547851,,2024-07-31,2024-07-31,monoswap__2024-07-31__4e9fa282,name#monoswap
Multichain,7/7/23,Infrastructure,Private Key Compromised (Unknown Method),126000000.0,"Moonriver,BSC,Fantom",True,DeFi Protocol,,591.0,,https://twitter.com/tayvano_/status/1677106407131475968?t=VKQSi0VcSbv_Jgi8Q58SqQ&s=19,,2023-07-07,2023-07-07,multichain__2023-07-07__599c75b4,defillama#591
Belt Finance,5/29/21,Ecosystem,Flashloan Price Oracle Attack,6300000.0,BSC,False,DeFi Protocol,,310.0,Solidity,https://rekt.news/belt-rekt/,,2021-05-29,2021-05-29,belt-finance__2021-05-29__325143f9,defillama#310
Texture,7/9/25,,,2200000.0,Solana,False,DeFi Protocol,,,Rust,https://x.com/texture_fi/status/1942972150631002245,,2025-07-09,2025-07-09,texture__2025-07-09__0c8faa88,name#texture
Arbix Finance,1/4/22,Rugpull,Drained Contracts,10000000.0,BSC,False,DeFi Protocol,,,Solidity,https://rekt.news/arbix-rekt/,,2022-01-04,2022-01-04,arbix-finance__2022-01-04__1759ad13,name#arbix-finance
Bybit,2/21/25,Protocol Logic,Safe Multisig wallet Phishing Exploit,1400000000.0,Ethereum,False,CEX,1400000000.0,2286.0,Solidity,https://x.com/benbybit/status/1892963530422505586,,2025-02-21,2025-02-21,bybit__2025-02-21__5c16de6d,defillama#2286
Save,11/2/22,Ecosystem,Price Oracle Attack,1260000.0,Solana,False,DeFi Protocol,,458.0,Rust,https://twitter.com/solendprotocol/status/1587671511137398784,parent#save-protocol,2022-11-02,2022-11-02,save__2022-11-02__a6559c16,parent#save-protocol
Amun,12/26/22,Protocol Logic,Controlled Rebalance Manipulation,300000.0,Ethereum,False,DeFi Protocol,,400.0,,https://medium.com/amun-tokens/peco-dfi-post-mortem-december-26th-2022-46576394def9,,2022-12-26,2022-12-26,amun__2022-12-26__8fbb9800,defillama#400
GANA Payment,11/20/25,Infrastructure,Private Key Compromised,3100000.0,BSC,False,DeFi Protocol,,,Solidity,https://www.theblock.co/post/379619/gana-payment-exploit,,2025-11-20,2025-11-20,gana-payment__2025-11-20__42463250,name#gana-payment
Thorchain DEX,7/15/21,Protocol Logic,Over-ride Logic Exploit,5000000.0,Ethereum,False,DeFi Protocol,,412.0,Solidity,https://rekt.news/thorchain-rekt/,,2021-07-15,2021-07-15,thorchain-dex__2021-07-15__c3dac341,defillama#412
Roll,3/14/21,Infrastructure,Private Key Compromised (Unknown Method),5700000.0,Ethereum,False,DeFi Protocol,,,,https://rekt.news/roll-rekt/,,2021-03-14,2021-03-14,roll__2021-03-14__fca6b15e,name#roll
Warp Protocol,12/18/20,Ecosystem,Flashloan Price Oracle Attack,7800000.0,Ethereum,False,DeFi Protocol,,601.0,Solidity,https://rekt.news/warp-finance-rekt/,,2020-12-18,2020-12-18,warp-protocol__2020-12-18__1032dac6,defillama#601
ThalaSwap,11/15/24,Protocol Logic,Drained Liquidity Pool,25500000.0,Aptos,False,DeFi Protocol,,2795.0,Move,https://cointelegraph.com/news/thala-recovers-25-million-exploiter-hacker-caught,parent#thala-labs,2024-11-15,2024-11-15,thalaswap__2024-11-15__17c8a153,parent#thala-labs
Raft,11/10/23,Protocol Logic,Infinite Mint and Dump,3300000.0,Ethereum,False,DeFi Protocol,,3068.0,Solidity,https://twitter.com/AnciliaInc/status/1723055359034568828,,2023-11-10,2023-11-10,raft__2023-11-10__3190e252,defillama#3068
Kalax,10/14/24,Rugpull,Drain Vaults,350000.0,Blast,False,DeFi Protocol,,4677.0,Solidity,https://x.com/0x50313335/status/1845398390491726296,,2024-10-14,2024-10-14,kalax__2024-10-14__ac8da088,defillama#4677
MSCST,12/28/25,Protocol Logic,Atomic Sandwich Attack,129900.0,BSC,False,DeFi Protocol,,,Solidity,https://x.com/hklst4r/status/2005515461773885670,,2025-12-28,2025-12-28,mscst__2025-12-28__02382976,name#mscst
EraLend,7/25/23,Protocol Logic,Reentrancy,3400000.0,zkSync Era,False,DeFi Protocol,,2746.0,Solidity,https://twitter.com/DLNewsInfo/status/1683870083272130562,,2023-07-25,2023-07-25,eralend__2023-07-25__d4c6f334,defillama#2746
Banana Gun,9/19/24,Protocol Logic,Front-end vulnerability,3000000.0,Ethereum,False,DeFi Protocol,3000000.0,3336.0,,https://x.com/BananaGunBot/status/1838660010387116484,,2024-09-19,2024-09-19,banana-gun__2024-09-19__2ae897a6,defillama#3336
Acala Network,8/13/21,Protocol Logic,Incentives Function Mistake,1600000.0,Acala,False,DeFi Protocol,,,Solidity,https://twitter.com/alice_und_bob/status/1558959878475075584,,2021-08-13,2021-08-13,acala-network__2021-08-13__def6b11f,name#acala-network
Mobius Token,5/11/25,Protocol Logic,Decimal Miscalculation Exploit,2160000.0,BSC,False,DeFi Protocol,,,Solidity,https://www.certik.com/resources/blog/mobius-token-incident-analysis,,2025-05-11,2025-05-11,mobius-token__2025-05-11__34a8c1a3,name#mobius-token
DODO AMM,3/9/21,Protocol Logic,Access Control Exploit,2000000.0,Ethereum,False,DeFi Protocol,,146.0,Solidity,https://rekt.news/au-dodo-rekt/,parent#dodo,2021-03-09,2021-03-09,dodo-amm__2021-03-09__968024e8,parent#dodo
BonqDAO,2/1/23,Protocol Logic,Price Oracle Attack,1700000.0,Polygon,False,DeFi Protocol,,2477.0,Solidity,https://twitter.com/peckshield/status/1620917292514299904?s=20&t=ZroERzkeCrxy3gHxtboQeA,,2023-02-01,2023-02-01,bonqdao__2023-02-01__82e4e48e,defillama#2477
Beanstalk,4/17/22,Ecosystem,Flashloan Governance Attack,181000000.0,Ethereum,False,DeFi Protocol,,631.0,Solidity,https://twitter.com/FrankResearcher/status/1515693895887294466?s=20,parent#beanstalk,2022-04-17,2022-04-17,beanstalk__2022-04-17__66e1e46a,parent#beanstalk
Pickle,11/22/20,Protocol Logic,Vault Swap Exploit,19700000.0,Ethereum,False,DeFi Protocol,,134.0,Solidity,https://github.com/banteg/evil-jar/blob/master/readme.md,,2020-11-22,2020-11-22,pickle__2020-11-22__8d6c80a2,defillama#134
Minterest,7/15/24,Protocol Logic,Reentrancy,1400000.0,Mantle,False,DeFi Protocol,,,Solidity,https://x.com/Minterest/status/1812540672248820033,,2024-07-15,2024-07-15,minterest__2024-07-15__23b46c78,name#minterest
dForce,2/10/23,Protocol Logic,Reentrancy,3650000.0,"Arbitrum,Optimism",False,DeFi Protocol,,123.0,Solidity,https://twitter.com/peckshield/status/1623902441992523776,,2023-02-10,2023-02-10,dforce__2023-02-10__47833195,defillama#123
pNetwork,11/3/22,Protocol Logic,Misconfiguration,4589449.0,BSC,True,DeFi Protocol,4589449.0,547.0,Solidity,https://twitter.com/pNetworkDeFi/status/1588956872664829952,,2022-11-03,2022-11-03,pnetwork__2022-11-03__0aa74177,defillama#547
Loopring,6/9/24,Protocol Logic,Guardian 2FA service exploit,5000000.0,Loopring,False,DeFi Protocol,,126.0,,https://x.com/loopringorg/status/1799791898296451515,,2024-06-09,2024-06-09,loopring__2024-06-09__551d27e4,defillama#126
Seedify,9/23/25,Infrastructure,Infinite Mint and Dump,1000000.0,"BSC,Avalanche",True,DeFi Protocol,,1511.0,Solidity,https://x.com/meta_alchemist/status/1970470733017968841,,2025-09-23,2025-09-23,seedify__2025-09-23__389a7898,defillama#1511
Dego Finance,2/10/22,Infrastructure,Private Key Compromised (Unknown Method),10000000.0,"Ethereum,BSC,Cronos",False,DeFi Protocol,,,,https://rekt.news/dego-finance-rekt/,,2022-02-10,2022-02-10,dego-finance__2022-02-10__3b0885ad,name#dego-finance
Bunni V2,9/2/25,Protocol Logic,Liquidity Distribution Function Exploit,8400000.0,"Ethereum,Unichain",False,DeFi Protocol,,5734.0,Solidity,https://x.com/CertiKAlert/status/1962755574283768308,parent#bunni,2025-09-02,2025-09-02,bunni-v2__2025-09-02__42b15335,parent#bunni
Blur Finance,8/10/22,Rugpull,Drained Contracts,600000.0,"BSC,Polygon",False,DeFi Protocol,,1891.0,Solidity,https://cryptoslate.com/blur-finance-allegedly-rug-pulled-investors-at-a-combined-600k-loss/,,2022-08-10,2022-08-10,blur-finance__2022-08-10__e8c9c013,defillama#1891
Team Finance,10/27/22,Protocol Logic,Migrate Function Mistake Exploit,15800000.0,Ethereum,False,DeFi Protocol,,1864.0,Solidity,https://twitter.com/peckshield/status/1585587858978623491?s=20&t=vAGSJQ0ivXGoOv80bGx4iQ,,2022-10-27,2022-10-27,team-finance__2022-10-27__e6ac364c,defillama#1864
Eminence,9/28/20,Ecosystem,Flashloan Price Oracle Attack,15000000.0,Ethereum,False,DeFi Protocol,,,Solidity,https://rekt.news/eminence-rekt-in-prod/,,2020-09-28,2020-09-28,eminence__2020-09-28__ca89009a,name#eminence
Pike,4/30/24,Protocol Logic,Storage Misalignment Exploit,1600000.0,"Ethereum,Optimism,Arbitrum",False,DeFi Protocol,1600000.0,4100.0,Solidity,https://twitter.com/PikeFinance/status/1785572875124330644,,2024-04-30,2024-04-30,pike__2024-04-30__9f84cd30,defillama#4100
MoonHacker,1/2/25,Protocol Logic,Unchecked FlashLoan Approve Exploit,300000.0,Optimism,False,DeFi Protocol,,,Solidity,https://x.com/dedaub/status/1874838342485102852,,2025-01-02,2025-01-02,moonhacker__2025-01-02__82ddc9a2,name#moonhacker
Balancer V2,8/27/23,Protocol Logic,,800000.0,Ethereum,False,DeFi Protocol,,2611.0,Solidity,https://twitter.com/mevrefund/status/1695792040531960116,parent#balancer,2023-08-27,2023-08-27,balancer-v2__2023-08-27__1eb4db71,parent#balancer
DeltaPrime,9/16/24,Protocol Logic,Private Key Compromised (Unknown Method),5980000.0,Arbitrum,False,DeFi Protocol,,2479.0,Solidity,https://x.com/CryptoTimes_io/status/1835620537055514652,,2024-09-16,2024-09-16,deltaprime__2024-09-16__9c8ff92c,defillama#2479
Nexera,8/7/24,Protocol Logic,Ownership Override Attack,1800000.0,Ethereum,False,DeFi Protocol,,,Solidity,https://www.coindesk.com/business/2024/08/07/blockchain-protocol-nexara-suffers-18m-exploit-nxra-tumbles-40/,,2024-08-07,2024-08-07,nexera__2024-08-07__6cf88bed,name#nexera
Infini,2/24/25,Protocol Logic,Dev Privilege Oversight Exploit,49500000.0,Ethereum,False,DeFi Protocol,,,,https://x.com/peckshieldalert/status/1893874770803851454,,2025-02-24,2025-02-24,infini__2025-02-24__39a3fb87,name#infini
MM Finance Cronos,5/4/22,Infrastructure,DNS Spoofing,2000000.0,Cronos,False,DeFi Protocol,,1028.0,,https://medium.com/@MMFinance/dns-hi-jacking-post-mortem-compensation-3e2b5bb21183,parent#mm-finance,2022-05-04,2022-05-04,mm-finance-cronos__2022-05-04__842ae64d,parent#mm-finance
Revest Finance,3/27/22,Smart Contract Language,Reentrancy,2010000.0,Ethereum,False,DeFi Protocol,,830.0,Solidity,https://twitter.com/BlockSecTeam/status/1508065573250678793?s=20&t=NXJmfrEeRP3-fqmOwjOAGQ,,2022-03-27,2022-03-27,revest-finance__2022-03-27__801ecc57,defillama#830
Tropykus RSK,6/14/23,Protocol Logic,Redeem Rounding Error Exploit,150000.0,Rootstock,False,DeFi Protocol,,1464.0,Solidity,https://twitter.com/tropykus/status/1669310852787216385,parent#tropykus-finance,2023-06-14,2023-06-14,tropykus-rsk__2023-06-14__27b87636,parent#tropykus-finance
Arena SocialFi,10/7/23,Protocol Logic,Reentrancy,2900000.0,Avalanche,False,Other,,3564.0,Solidity,https://twitter.com/peckshield/status/1710555944269292009?t=Al_-cDBwoNs3vpKqcpJ0Jw&s=19,parent#the-arena,2023-10-07,2023-10-07,arena-socialfi__2023-10-07__82572f26,parent#the-arena
Phemex,1/23/25,Infrastructure,Private Key Compromised (Unknown Method),85000000.0,"Ethereum,Solana,XRP,Bitcoin,BSC,Sui,Base,Tron,Arbitrum,Avalanche,Polygon,Optimism,zkSync Era",False,CEX,,2369.0,,https://x.com/PeckShieldAlert/status/1882776555312869830,,2025-01-23,2025-01-23,phemex__2025-01-23__d5ce6ebc,defillama#2369
BlueBerry,2/24/24,Protocol Logic,Flashloan Price Oracle Attack,1400000.0,Ethereum,False,DeFi Protocol,,,Solidity,https://x.com/blueberryFDN/status/1760872935982879030,,2024-02-24,2024-02-24,blueberry__2024-02-24__4756dffd,name#blueberry
Crema Finance,7/2/22,Protocol Logic,Access Control Exploit,8800000.0,Solana,False,DeFi Protocol,,1412.0,Rust,https://twitter.com/Crema_Finance/status/1543638844410499073?s=20&t=tjkZ9crEBqMSfzI2BMG_oQ,,2022-07-02,2022-07-02,crema-finance__2022-07-02__50ed1552,defillama#1412
AzukiDAO,7/3/23,Protocol Logic,Replay Attack,68000.0,Ethereum,False,DeFi Protocol,,,Solidity,https://twitter.com/dedaub/status/1675983033168453632?s=20,,2023-07-03,2023-07-03,azukidao__2023-07-03__8d56c5d1,name#azukidao
Tenderize V2,4/7/25,Protocol Logic,Proxy Upgrade Skim,10850.0,Ethereum,False,DeFi Protocol,,4085.0,Solidity,https://x.com/dedaub/status/1914815361616367872,parent#tenderize,2025-04-07,2025-04-07,tenderize-v2__2025-04-07__51468c4d,parent#tenderize
Pando Rings,11/6/22,Ecosystem,Price Oracle Attack,22000000.0,Mixin,False,DeFi Protocol,,2204.0,Go,https://pando.im/news/2022/2022-11-06-alert-to-pando-community-hack-of-pando-rings/,parent#pando,2022-11-06,2022-11-06,pando-rings__2022-11-06__3780fadc,parent#pando
DEUS Finance,5/5/23,Protocol Logic,Burn Function Mistake,6500000.0,"Arbitrum,BSC,Ethereum",False,DeFi Protocol,,1387.0,Solidity,https://twitter.com/storming0x/status/1654561199999135747?s=20,,2023-05-05,2023-05-05,deus-finance__2023-05-05__e11419c2,defillama#1387
Mixin Network,9/23/23,Infrastructure,Database Attack,200000000.0,Mixin,False,Other,,,,https://twitter.com/MixinKernel/status/1706139175018529139,,2023-09-23,2023-09-23,mixin-network__2023-09-23__c4d85b97,name#mixin-network
Fantasm Finance,3/9/22,Protocol Logic,Missing Condition Check,2260000.0,Fantom,False,DeFi Protocol,,,Solidity,https://quadrigainitiative.com/cryptocurrencyhackscamfraudwiki/index.php?title=Fantasm_Finance_Contract_Vulnerabilities,,2022-03-09,2022-03-09,fantasm-finance__2022-03-09__88f71989,name#fantasm-finance
LeetSwap,8/1/23,Protocol Logic,Liquidity Pools Compromised,620000.0,Base,False,DeFi Protocol,,2745.0,Solidity,https://twitter.com/TheBlock__/status/1686201265758326784,,2023-08-01,2023-08-01,leetswap__2023-08-01__4f6c76fa,defillama#2745
Astera.fi,10/9/25,Protocol Logic,Oracle Price Feed Manipulation,573000.0,Linea,False,DeFi Protocol,,,Solidity,https://x.com/hklst4r/status/1976296543872233508,,2025-10-09,2025-10-09,astera-fi__2025-10-09__e31c0245,name#astera-fi
Hegic(old contract),3/1/25,Protocol Logic,Unlimited repeated withdrawal exploit,94000.0,Ethereum,False,DeFi Protocol,,,Solidity,https://x.com/HegicOptions/status/1896933787923345470,,2025-03-01,2025-03-01,hegic-old-contract__2025-03-01__5c91d57a,name#hegic-old-contract
Hyperliquid,6/15/23,Ecosystem,CEX Price Manipulation Attack,37000.0,Arbitrum,False,DeFi Protocol,,2862.0,,https://twitter.com/HyperliquidX/status/1669818300191363073,,2023-06-15,2023-06-15,hyperliquid__2023-06-15__2eb0625c,defillama#2862
Moby,1/8/25,Infrastructure,Private Key Compromised (Unknown Method),1470000.0,Arbitrum,False,DeFi Protocol,,4452.0,Solidity,https://x.com/Moby_trade/status/1877096336140677458,,2025-01-08,2025-01-08,moby__2025-01-08__71e43ce5,defillama#4452
1inch,3/7/25,Protocol Logic,Calldata underflow and resolver hijack,5000000.0,Ethereum,False,DeFi Protocol,,189.0,Solidity,https://blog.1inch.io/vulnerability-discovered-in-resolver-contract/,,2025-03-07,2025-03-07,1inch__2025-03-07__99c7eb4c,defillama#189
Eleven Finance,6/22/21,Ecosystem,Flashloan Burn Function Exploit,4500000.0,BSC,False,DeFi Protocol,,583.0,Solidity,https://rekt.news/11-rekt/,,2021-06-22,2021-06-22,eleven-finance__2021-06-22__03b49ad9,defillama#583
CheeseBank,11/16/20,Ecosystem,Flashloan Price Oracle Attack,3300000.0,Ethereum,False,DeFi Protocol,,,,https://twitter.com/CheeseBank2020/status/1328343819201380353?s=20&t=qtl30Yo9ErEoVr8v3T20dg,,2020-11-16,2020-11-16,cheesebank__2020-11-16__c068ed05,name#cheesebank
Vulcan Forged,12/13/21,Infrastructure,Private Key Compromised (Unknown Method),140000000.0,"Ethereum,Polygon",False,DeFi Protocol,,,,https://rekt.news/vulcan-forged-rekt/,,2021-12-13,2021-12-13,vulcan-forged__2021-12-13__90fd549b,name#vulcan-forged
Slope Wallet,8/2/22,Infrastructure,Private Key Compromised (Stored Publicly),5300000.0,Solana,False,Wallet,,,,https://solana.com/news/8-2-2022-application-wallet-incident,,2022-08-02,2022-08-02,slope-wallet__2022-08-02__7a220c0a,name#slope-wallet
Rari Capital,5/1/22,Ecosystem,Flashloan Reentrancy Attack,80000000.0,"Ethereum,Arbitrum",False,DeFi Protocol,,136.0,Solidity,https://twitter.com/Hacxyk/status/1520370421773725698?s=20&t=3ZdC2UMcxHaD73SwrcnudQ,,2022-05-01,2022-05-01,rari-capital__2022-05-01__f4d184ea,defillama#136
ALEX,5/16/24,Infrastructure,Private Key Compromised (Phishing),4300000.0,Stacks,False,DeFi Protocol,,1466.0,,https://rekt.news/alexlab-rekt/,,2024-05-16,2024-05-16,alex__2024-05-16__8aaa19da,defillama#1466
Onyx V2,9/26/24,Protocol Logic,Liquidation Logic Exploit,4000000.0,Ethereum,False,DeFi Protocol,,5180.0,Solidity,https://x.com/blocksecteam/status/1839314277359849484,parent#onyx,2024-09-26,2024-09-26,onyx-v2__2024-09-26__1144f610,parent#onyx
UwU Lend,6/13/24,Ecosystem,Flashloan Price Oracle Attack,3700000.0,Ethereum,False,DeFi Protocol,,2111.0,Solidity,https://x.com/TheBlock__/status/1801177660946612664,,2024-06-13,2024-06-13,uwu-lend__2024-06-13__17ecce1e,defillama#2111
Spartan,5/2/21,Ecosystem,Flashloan Pool Shares Exploit,30500000.0,BSC,False,DeFi Protocol,,1246.0,Solidity,https://peckshield-94632.medium.com/the-spartan-incident-root-cause-analysis-b14135d3415f,,2021-05-02,2021-05-02,spartan__2021-05-02__fd16e9b5,defillama#1246
Huobi,11/22/23,Infrastructure,Private Key Compromised (Unknown Method),26400000.0,Ethereum,False,CEX,,,,https://twitter.com/TheBlock__/status/1727397707843621201,,2023-11-22,2023-11-22,huobi__2023-11-22__4ffa9f46,name#huobi
402bridge,10/27/25,Infrastructure,Private Key Compromised (Stored Publicly),17000.0,Base,True,DeFi Protocol,,,Solidity,https://x.com/PeckShieldAlert/status/1983029273528283503,,2025-10-27,2025-10-27,402bridge__2025-10-27__68c7186b,name#402bridge
Poly Network,7/2/23,Infrastructure,Private Key Compromised (Unknown Method),5000000.0,"Ethereum,BSC,Polygon",True,DeFi Protocol,,1796.0,Solidity,https://twitter.com/dedaub/status/1675516729349292032?s=20,,2023-07-02,2023-07-02,poly-network__2023-07-02__1e570091,defillama#1796
Mirror,10/8/21,Smart Contract Language,Duplicate Call Exploit,90000000.0,Terra,False,DeFi Protocol,,260.0,Rust,https://blocksecteam.medium.com/how-the-mirror-protocol-is-exploited-33b5c1d48322,,2021-10-08,2021-10-08,mirror__2021-10-08__b41a087d,defillama#260
Merlin,5/26/21,Ecosystem,Flashloan Incentive Rewards Exploit,680000.0,BSC,False,DeFi Protocol,,370.0,Solidity,https://rekt.news/merlinlabs-rekt/,,2021-05-26,2021-05-26,merlin__2021-05-26__7da24384,defillama#370
8ightDAO,12/8/21,Infrastructure,Private Key Compromised (Unknown Method),1750000.0,Harmony,False,DeFi Protocol,,889.0,,https://rekt.news/8ight-finance-rekt/,,2021-12-08,2021-12-08,8ightdao__2021-12-08__a7e60a60,defillama#889
Rari Capital,12/18/25,Protocol Logic,Uninitialized Proxy Hijack,2000000.0,Ethereum,False,DeFi Protocol,,136.0,Solidity,https://x.com/zmtO21/status/2001585158106026270,,2025-12-18,2025-12-18,rari-capital__2025-12-18__871e0411,defillama#136
0vix,4/28/23,Ecosystem,Flashloan Donate Function Logic Exploit,2000000.0,Polygon,False,DeFi Protocol,,1614.0,Solidity,https://twitter.com/peckshield/status/1651923235603361793?s=20,,2023-04-28,2023-04-28,0vix__2023-04-28__a8fe8002,defillama#1614
SUNRAYFINANCE,10/30/24,Infrastructure,Private Key Compromised,2855000.0,Arbitrum,False,DeFi Protocol,,,Solidity,https://x.com/CertiKAlert/status/1851816489286041885,,2024-10-30,2024-10-30,sunray-finance__2024-10-30__953eee44,name#sunray-finance
Levana Perps,12/27/23,Protocol Logic,Price Oracle Attack,1100000.0,Osmosis,False,DeFi Protocol,,3474.0,Rust,https://twitter.com/Levana_protocol/status/1740071199483543819,,2023-12-27,2023-12-27,levana-perps__2023-12-27__6f2ebb34,defillama#3474
Impermax V3,4/26/25,Protocol Logic,Flashloan Exploit,300000.0,Base,False,DeFi Protocol,,5981.0,Solidity,https://x.com/ImpermaxFinance/status/1916123070223339553,parent#impermax-finance,2025-04-26,2025-04-26,impermax-v3__2025-04-26__f654164a,parent#impermax-finance
Astrid Finance,10/29/23,Protocol Logic,Withdraw Function Argument Manipulation,228000.0,Ethereum,False,DeFi Protocol,,,,https://twitter.com/Phalcon_xyz/status/1718455634155409489,,2023-10-29,2023-10-29,astrid-finance__2023-10-29__debcd3fa,name#astrid-finance
SIR,3/30/25,Protocol Logic,Transient storage collision,355000.0,Ethereum,False,DeFi Protocol,,5842.0,Solidity,https://x.com/leveragesir/status/1906265780057972854,,2025-03-30,2025-03-30,sir__2025-03-30__207530a0,defillama#5842
Lava,3/29/24,Protocol Logic,Calculation Error in Liquidation Engine,340000.0,Arbitrum,False,DeFi Protocol,,4241.0,Solidity,https://twitter.com/CertiKAlert/status/1773584949855277261,,2024-03-29,2024-03-29,lava__2024-03-29__eadac808,defillama#4241
Inverse Finance Frontier,6/16/22,Ecosystem,Flashloan Price Oracle Attack,5800000.0,Ethereum,False,DeFi Protocol,,338.0,Solidity,https://twitter.com/peckshield/status/1537382891230883841?s=20&t=uxBt2fIcD_f82MM2VD3pCg,parent#inverse-finance,2022-06-16,2022-06-16,inverse-finance-frontier__2022-06-16__43305a13,parent#inverse-finance
Balancer V2,9/19/23,Protocol Logic,Frontend Attack,238000.0,Ethereum,False,DeFi Protocol,,2611.0,,https://twitter.com/PeckShieldAlert/status/1704306602529247294,parent#balancer,2023-09-19,2023-09-19,balancer-v2__2023-09-19__f8f36220,parent#balancer
SushiSwap,4/10/23,Protocol Logic,Missing Input Validation,3300000.0,"Ethereum,Arbitrum,Optimism,BSC",False,DeFi Protocol,3300000.0,,Solidity,https://x.com/ernestognw/status/1645113041430757378,,2023-04-10,2023-04-10,sushiswap__2023-04-10__5a2b34ca,name#sushiswap
Gamma,12/21/21,Protocol Logic,Access Control Exploit,8200000.0,Ethereum,False,DeFi Protocol,,355.0,Solidity,https://medium.com/visorfinance/post-mortem-for-vvisr-staking-contract-exploit-and-upcoming-migration-7920e1dee55a,,2021-12-21,2021-12-21,gamma__2021-12-21__a3288a73,defillama#355
Bunny,5/19/21,Ecosystem,Flashloan Price Oracle Attack,45000000.0,BSC,False,DeFi Protocol,,254.0,Solidity,https://peckshield.medium.com/pancakebunny-incident-root-cause-analysis-7099f413cc9b,,2021-05-19,2021-05-19,bunny__2021-05-19__5b47256a,defillama#254
RiskOnBlast,2/25/24,Rugpull,,1300000.0,Blast,False,DeFi Protocol,,,,https://www.certik.com/resources/blog/risk-on-blast-incident-analysis,,2024-02-25,2024-02-25,riskonblast__2024-02-25__5c219c79,name#riskonblast
Jimbos Protocol,5/28/23,Ecosystem,Flashloan Slippage Attack,7500000.0,Arbitrum,False,DeFi Protocol,,,Solidity,https://twitter.com/peckshield/status/1662650673731624961?s=20,,2023-05-28,2023-05-28,jimbos-protocol__2023-05-28__8c5ba19c,name#jimbos-protocol
ValueDefi,5/5/21,Protocol Logic,Access Control Exploit,10000000.0,BSC,False,DeFi Protocol,,164.0,Solidity,https://rekt.news/value-rekt2/,parent#value-finance,2021-05-05,2021-05-05,valuedefi__2021-05-05__d7c7a137,parent#value-finance
Bent Finance,12/21/21,Protocol Logic,User Balances Manually Updated,1750000.0,Ethereum,False,DeFi Protocol,,,Solidity,https://rekt.news/bent-finance/,,2021-12-21,2021-12-21,bent-finance__2021-12-21__b28a6e62,name#bent-finance
LND,5/9/25,Protocol Logic,,1300000.0,"Sonic,Hyperliquid L1",False,DeFi Protocol,,6071.0,,https://x.com/Lnd_fi/status/1920705062143250845,,2025-05-09,2025-05-09,lnd__2025-05-09__5f23961b,defillama#6071
Platypus Finance,2/16/23,Ecosystem,Flashloan Reentrancy Attack,8500000.0,Avalanche,False,DeFi Protocol,222634.0,944.0,Solidity,https://twitter.com/CertiKAlert/status/1626318821840629763,,2023-02-16,2023-02-16,platypus-finance__2023-02-16__89968b6f,defillama#944
RocketSwap Base,8/15/23,Infrastructure,Private Key Compromised (Brute Force),865000.0,Base,False,DeFi Protocol,,3314.0,Solidity,https://twitter.com/Cointelegraph/status/1691316548932456448,,2023-08-15,2023-08-15,rocketswap-base__2023-08-15__d95cdfe2,defillama#3314
Zoth ZeUSD,3/21/25,Infrastructure,Private Key Compromised (Unknown Method),8850000.0,Ethereum,False,DeFi Protocol,,5615.0,Solidity,https://x.com/PeckShieldAlert/status/1903029531558154725,parent#zoth,2025-03-21,2025-03-21,zoth-zeusd__2025-03-21__ecc3d7a1,parent#zoth
Flow,12/27/25,Protocol Logic,mint-and-dump Hack,3900000.0,Flow,False,Layer 1,,6104.0,Solidity,https://x.com/flow_blockchain/status/2005021612714668518,,2025-12-27,2025-12-27,flow__2025-12-27__d1d426c0,defillama#6104
Levyathan,7/30/21,Infrastructure,Private Key Compromised (Stored Publicly),1500000.0,BSC,False,DeFi Protocol,,,Solidity,https://rekt.news/levyathan-rekt/,,2021-07-30,2021-07-30,levyathan__2021-07-30__d9409f74,name#levyathan
Cetus CLMM,5/22/25,Protocol Logic,Spoof Token Exploit,223000000.0,Sui,False,DeFi Protocol,,2289.0,Move,https://www.coindesk.com/markets/2025/05/22/sui-networks-cetus-protocol-hit-in-apparent-hack-sending-token-prices-down-90,parent#cetus,2025-05-22,2025-05-22,cetus-clmm__2025-05-22__e7e61580,parent#cetus
Uranium Finance,4/28/21,Protocol Logic,Math Mistake Exploit,57200000.0,BSC,False,DeFi Protocol,,,Solidity,https://rekt.news/uranium-rekt/,,2021-04-28,2021-04-28,uranium-finance__2021-04-28__a43a121c,name#uranium-finance
Cypher,8/7/23,,Unknown,1035000.0,Solana,False,DeFi Protocol,,2575.0,,https://twitter.com/cypher_protocol/status/1688641036476731393,,2023-08-07,2023-08-07,cypher__2023-08-07__ff95a55a,defillama#2575
WOO X,7/24/25,Ecosystem,Social Engineering,14000000.0,"Bitcoin,Ethereum,Arbitrum,BSC",False,CEX,,2346.0,,https://x.com/BlockscopeCo/status/1948793062076940512,,2025-07-24,2025-07-24,woo-x__2025-07-24__361468a6,defillama#2346
ChainSwap,11/7/21,Protocol Logic,Exploit Weak Authentication Check,4400000.0,"Ethereum,BSC",True,DeFi Protocol,,,Solidity,https://chain-swap.medium.com/chainswap-exploit-11-july-2021-post-mortem-6e4e346e5a32,,2021-11-07,2021-11-07,chainswap__2021-11-07__632a58da,name#chainswap
1inch,10/31/24,Ecosystem,Private Key Compromised (Supply Chain Attack),720000.0,Avalanche,False,DeFi Protocol,,189.0,,https://x.com/1inch/status/1851832307746742686,,2024-10-31,2024-10-31,1inch__2024-10-31__2049995b,defillama#189
Dolomite,3/20/24,Protocol Logic,Acces Control Exploit,1800000.0,Ethereum,False,DeFi Protocol,,,Solidity,https://www.cryptotimes.io/2024/03/21/hacker-exploits-flaw-in-dolomite-project/,,2024-03-20,2024-03-20,dolomite__2024-03-20__677ac7bf,name#dolomite
CoinStats,7/12/24,Infrastructure,Private Key Compromised (Unknown Method),2200000.0,,False,Other,,,,https://x.com/CoinStats/status/1811706273395622063,,2024-07-12,2024-07-12,coinstats__2024-07-12__8c829eb0,name#coinstats
DogWifTools,1/28/25,Infrastructure,Private Key Compromised (Malware),10000000.0,Solana,False,Other,,,Move,https://x.com/kookcapitalllc/status/1884285558635323437,,2025-01-28,2025-01-28,dogwiftools__2025-01-28__4c8af460,name#dogwiftools
Harmony Bridge,6/23/22,Infrastructure,Private Key Compromised (Unknown Method),100000000.0,"Ethereum,BSC",True,DeFi Protocol,,,Solidity,https://rekt.news/harmony-rekt/,,2022-06-23,2022-06-23,harmony-bridge__2022-06-23__86aef7bc,name#harmony-bridge
BTC24H,12/16/24,Protocol Logic,Acces Control Exploit,85700.0,Polygon,False,DeFi Protocol,,,,https://x.com/0xCommitAudits/status/1871550202508951917,,2024-12-16,2024-12-16,btc24h__2024-12-16__f3d5c8a8,name#btc24h
Vee Finance,9/21/21,Ecosystem,Flashloan Price Oracle Attack,34000000.0,Avalanche,False,DeFi Protocol,,619.0,Solidity,https://veefi.medium.com/vee-finance-attack-analysis-a4839724e085,,2021-09-21,2021-09-21,vee-finance__2021-09-21__580720ca,defillama#619
Uwerx,8/2/23,Ecosystem,Flashloan Pool Shares Exploit,327000.0,Ethereum,False,Other,,,,https://twitter.com/CertiKAlert/status/1686667720920625152,,2023-08-02,2023-08-02,uwerx__2023-08-02__c13f034d,name#uwerx
WazirX: India,7/18/24,Infrastructure,Safe Multisig wallet Phishing Exploit,234900000.0,Ethereum,False,CEX,,,,https://x.com/CyversAlerts/status/1813834131165286464,,2024-07-18,2024-07-18,wazirx-india__2024-07-18__be38df8c,name#wazirx-india
GDAC,4/8/23,Infrastructure,Hot wallet hack,13900000.0,,False,CEX,,,,https://twitter.com/MetaSleuth/status/1645692516401033216,,2023-04-08,2023-04-08,gdac__2023-04-08__bb45a965,name#gdac
YOLO Games,6/11/24,Protocol Logic,Access Control Exploit,1500000.0,Blast,False,DeFi Protocol,,,Solidity,https://x.com/shoucccc/status/1800353122159833195,,2024-06-11,2024-06-11,yolo-games__2024-06-11__bf415dd8,name#yolo-games
Snowdog,11/25/21,Rugpull,Drained Contracts,18100000.0,Avalanche,False,DeFi Protocol,,859.0,Solidity,https://rekt.news/snowdog-rekt/,,2021-11-25,2021-11-25,snowdog__2021-11-25__88baf151,defillama#859
Swaprum,5/19/23,Rugpull,Drained Contracts,3000000.0,Arbitrum,False,DeFi Protocol,,2903.0,,https://www.dlnews.com/articles/defi/defi-protocol-swaprum-in-3m-rug-pull-was-certik-audited/?utm_campaign=,,2023-05-19,2023-05-19,swaprum__2023-05-19__94e33e99,defillama#2903
Hacken Token,6/20/25,Infrastructure,Private Key Compromised,250000.0,,False,Other,,,Solidity,https://x.com/peckshieldalert/status/1936198957119774979,,2025-06-20,2025-06-20,hacken-token__2025-06-20__be98a3b5,name#hacken-token
Gym Network,6/8/22,Protocol Logic,Deposit Function Exploit,2100000.0,BSC,False,DeFi Protocol,,,Solidity,https://rekt.news/gymnet-rekt/,,2022-06-08,2022-06-08,gym-network__2022-06-08__54e90b93,name#gym-network
UwU Lend,6/10/24,Ecosystem,Flashloan Price Oracle Attack,20000000.0,Ethereum,False,DeFi Protocol,,2111.0,Solidity,https://x.com/theblockupdates/status/1800146327914877062,,2024-06-10,2024-06-10,uwu-lend__2024-06-10__530b1b48,defillama#2111
Platypus Finance,10/13/23,Protocol Logic,Reentrancy,2200000.0,Avalanche,False,DeFi Protocol,,,Solidity,https://rekt.news/platypus-rekt2/,,2023-10-13,2023-10-13,platypus-finance__2023-10-13__bf2a3ddf,name#platypus-finance
Maestro,10/23/23,Protocol Logic,Arbitrary External Call,465000.0,Ethereum,False,DeFi Protocol,465000.0,,,https://x.com/MaestroBots/status/1717113987479785558,,2023-10-23,2023-10-23,maestro__2023-10-23__8a3df0de,name#maestro
US Permissionless Dollar,12/4/25,Protocol Logic,"""CPIMP"" proxy front-run",1000000.0,Ethereum,False,DeFi Protocol,,,Solidity,https://x.com/USPD_io/status/1996711283446464598,,2025-12-04,2025-12-04,us-permissionless-dollar__2025-12-04__bf47ee09,name#us-permissionless-dollar
Indodax,9/10/24,Infrastructure,Access Control Exploit,25200000.0,"Ethereum,Polygon,Optimism",False,CEX,,,,https://news.bitcoin.com/indonesian-crypto-exchange-hit-by-20-5m-hack-lazarus-group-suspected/,,2024-09-10,2024-09-10,indodax__2024-09-10__7145a9ea,name#indodax
Akropolis,11/12/20,Ecosystem,Flashloan Reentrancy Attack,2000000.0,Ethereum,False,DeFi Protocol,,,Solidity,https://rekt.news/akropolis-rekt/,,2020-11-12,2020-11-12,akropolis__2020-11-12__18ffcaff,name#akropolis
Origin Protocol,11/17/20,Ecosystem,Flashloan Reentrancy Attack,8000000.0,Ethereum,False,DeFi Protocol,,,Solidity,https://rekt.news/hack-epidemic/,,2020-11-17,2020-11-17,origin-protocol__2020-11-17__2db7f518,name#origin-protocol
DFX V2,11/10/22,Protocol Logic,Reentrancy,4000000.0,Ethereum,False,DeFi Protocol,,366.0,Solidity,https://twitter.com/peckshield/status/1590831589004816384?s=20&t=0ylCEXp_O5DBIbFTAHA9vA,parent#dfx-finance,2022-11-10,2022-11-10,dfx-v2__2022-11-10__a17d3a0f,parent#dfx-finance
MERLIN DEX,4/25/23,Rugpull,Drained Contracts,1820000.0,zkSync Era,False,DeFi Protocol,,2849.0,,https://twitter.com/TheMerlinDEX/status/1651281814395187200?t=p0udX-ZR1mQfkhNS9KCfEQ&s=19,,2023-04-25,2023-04-25,merlin-dex__2023-04-25__b8a166a0,defillama#2849
Transit Swap,10/2/22,Protocol Logic,Transfer Logic Exploit,21000000.0,"Ethereum,BSC",False,DeFi Protocol,,,Solidity,https://rekt.news/transit-swap-rekt/,,2022-10-02,2022-10-02,transit-swap__2022-10-02__0dfd4344,name#transit-swap
WXETA,9/16/24,Protocol Logic,Access Control Exploit,110000.0,"Ethereum,BSC",False,DeFi Protocol,,,Solidity,https://x.com/TenArmorAlert/status/1835494807495659645,,2024-09-16,2024-09-16,wxeta__2024-09-16__5925747f,name#wxeta
Palmswap,7/24/23,Protocol Logic,Inflationary Accounting Manipulation,900000.0,BSC,False,DeFi Protocol,,3279.0,Solidity,https://twitter.com/peckshield/status/1683609019334950912,,2023-07-24,2023-07-24,palmswap__2023-07-24__e33ff081,defillama#3279
HTX,9/25/23,Infrastructure,Private Key Compromised (Unknown Method),8000000.0,Ethereum,False,CEX,,,,https://twitter.com/justinsuntron/status/1706311251024822748?t=saJprSiK51MMd2GUBTnDsQ&s=19,,2023-09-25,2023-09-25,htx__2023-09-25__4a7b1529,name#htx
Radiant V2,1/2/24,Protocol Logic,Flashloan New Market Exploit,4500000.0,Arbitrum,False,DeFi Protocol,,2706.0,Solidity,https://twitter.com/peckshield/status/1742334242120466580,parent#radiant,2024-01-02,2024-01-02,radiant-v2__2024-01-02__7c5e34b4,parent#radiant
Tectonic,11/18/24,Protocol Logic,Price Oracle Attack,,Cronos,False,DeFi Protocol,,1115.0,,https://x.com/5outh53a/status/1858374778299748383,,2024-11-18,2024-11-18,tectonic__2024-11-18__ff4a185d,defillama#1115
Arcadia V1,7/10/23,Ecosystem,Flashloan Reentrancy Attack,460000.0,"Ethereum,Optimism",False,DeFi Protocol,,3210.0,,https://arcadiafinance.medium.com/post-mortem-72e9d24a79b0,parent#arcadia-finance,2023-07-10,2023-07-10,arcadia-v1__2023-07-10__79f0d163,parent#arcadia-finance
ALEX,6/6/25,Protocol Logic,malicious transfer() method,8373000.0,Stacks,False,DeFi Protocol,,1466.0,Clarity,https://x.com/ALEXLabBTC/status/1931014419133169734,,2025-06-06,2025-06-06,alex__2025-06-06__8911a48a,defillama#1466
GMX V1 Perps,7/9/25,Protocol Logic,Re-entrancy Exploit,42000000.0,Arbitrum,False,DeFi Protocol,40000000.0,337.0,Solidity,https://x.com/peckshield/status/1942947860645134450,parent#gmx,2025-07-09,2025-07-09,gmx-v1-perps__2025-07-09__d9d38bb6,parent#gmx
Ratio Finance,12/3/22,Infrastructure,Private Key Compromised (Unknown Method),,Solana,False,DeFi Protocol,,1841.0,Rust,https://twitter.com/RatioFinance/status/1621481456777428992,,2022-12-03,2022-12-03,ratio-finance__2022-12-03__75f264c4,defillama#1841
GemPad,12/17/24,Protocol Logic,Reentrancy,2000000.0,"Ethereum,Base,BSC",False,DeFi Protocol,,,,https://x.com/CyversAlerts/status/1869000606955782305,,2024-12-17,2024-12-17,gempad__2024-12-17__9a27b736,name#gempad
Compounder Finance,12/2/20,Rugpull,Drained Contracts,12000000.0,Ethereum,False,DeFi Protocol,,,Solidity,https://rekt.news/deathbed-confessions-c3pr/,,2020-12-02,2020-12-02,compounder-finance__2020-12-02__67f82edf,name#compounder-finance
Yearn Finance,4/13/23,Ecosystem,Flashloan Misconfiguration Exploit,11539000.0,Ethereum,False,DeFi Protocol,,113.0,Solidity,https://twitter.com/osec_io/status/1646411672175939585?s=20,parent#yearn,2023-04-13,2023-04-13,yearn-finance__2023-04-13__484d58ca,parent#yearn
LCX,1/8/22,Infrastructure,Private Key Compromised (Unknown Method),7940000.0,Ethereum,False,DeFi Protocol,,,,https://www.lcx.com/hot-wallet-incident-report/,,2022-01-08,2022-01-08,lcx__2022-01-08__8c17fe54,name#lcx
Silo Finance,6/25/25,Protocol Logic,fillQuote silo.borrow() Exploit,546000.0,Ethereum,False,DeFi Protocol,,,Solidity,https://x.com/CertiKAlert/status/1937882770216452174,,2025-06-25,2025-06-25,silo-finance__2025-06-25__d5db6faf,name#silo-finance
Curve DEX,8/9/22,Infrastructure,DNS Spoofing,575000.0,Ethereum,False,DeFi Protocol,575000.0,3.0,,https://rekt.news/curve-finance-rekt/,parent#curve-finance,2022-08-09,2022-08-09,curve-dex__2022-08-09__672f3fdf,parent#curve-finance
Conic Finance,7/22/23,Ecosystem,Flashloan Price Oracle Attack,300000.0,Ethereum,False,DeFi Protocol,,2616.0,Solidity,https://medium.com/@ConicFinance/post-mortem-eth-and-crvusd-omnipool-exploits-c9c7fa213a3d,,2023-07-22,2023-07-22,conic-finance__2023-07-22__e33f19c5,defillama#2616
CREAM Lending,10/27/21,Ecosystem,Flashloan Price Oracle Attack,130000000.0,Ethereum,False,DeFi Protocol,,121.0,Solidity,https://rekt.news/cream-rekt-2/,parent#cream-finance,2021-10-27,2021-10-27,cream-lending__2021-10-27__d0a103b2,parent#cream-finance
AnubisDAO,10/29/21,Rugpull,Drained Contracts,60000000.0,Ethereum,False,DeFi Protocol,,,Solidity,https://decrypt.co/84924/anubisdao-investors-lose-60-million-in-alleged-rug-pull,,2021-10-29,2021-10-29,anubisdao__2021-10-29__4f5c8b9a,name#anubisdao
Arcadia V2,7/15/25,Protocol Logic,Rebalancer contract reentrancy hack,2500000.0,Base,False,DeFi Protocol,,4455.0,Solidity,https://x.com/ArcadiaFi/status/1944984622183370867,parent#arcadia-finance,2025-07-15,2025-07-15,arcadia-v2__2025-07-15__bef2e898,parent#arcadia-finance
Sovryn,10/4/22,Protocol Logic,Flashloan Reentrancy Attack,1100000.0,RSK,False,DeFi Protocol,,,Solidity,https://www.halborn.com/blog/post/explained-the-sovryn-hack-october-2022,,2022-10-04,2022-10-04,sovryn__2022-10-04__a8f782e1,name#sovryn
Wintermute,9/20/22,Infrastructure,Private Key Compromised (Brute Force),160000000.0,Ethereum,False,Other,,,,https://slowmist.medium.com/the-real-cause-of-the-wintermute-exploit-10da7e404b3b,,2022-09-20,2022-09-20,wintermute__2022-09-20__099cab6d,name#wintermute
Zircon Gamma,3/18/23,Ecosystem,Flashloan Pool Shares Exploit,350000.0,"BSC,Moonriver",False,DeFi Protocol,,2143.0,,https://twitter.com/Zircon_Finance/status/1637093661321183233,,2023-03-18,2023-03-18,zircon-gamma__2023-03-18__011193c3,defillama#2143
Keep3r Network,6/12/23,Infrastructure,Private Key Compromised (Vanity Address),200000.0,Ethereum,False,DeFi Protocol,,636.0,Solidity,https://twitter.com/MetaSleuth/status/1668179353749041159,,2023-06-12,2023-06-12,keep3r-network__2023-06-12__3a0f7bf6,defillama#636
Resupply,6/25/25,Protocol Logic,Price Oracle Manipulation,9600000.0,Ethereum,False,DeFi Protocol,,5963.0,Solidity,https://x.com/peckshield/status/1938061948647817647,,2025-06-25,2025-06-25,resupply__2025-06-25__3a11aaca,defillama#5963
Ooki,2/18/20,Protocol Logic,Flashloan Price Oracle Attack,650000.0,Ethereum,False,DeFi Protocol,,197.0,,https://twitter.com/bneiluj/status/1228757175595438080?s=20&t=rHc453VaZzUqbci29H6YDA,,2020-02-18,2020-02-18,ooki__2020-02-18__9872c2ad,defillama#197
Concentric,1/22/24,Infrastructure,Private Key Compromised (Social Engineering),1720000.0,Arbitrum,False,DeFi Protocol,,,Solidity,https://twitter.com/ConcentricFi/status/1749418658818830622,,2024-01-22,2024-01-22,concentric__2024-01-22__fa0da136,name#concentric
ArbiSwap,3/2/23,Rugpull,Infinite Mint and Dump,100000.0,Arbitrum,False,DeFi Protocol,,2587.0,,https://twitter.com/CoinDesk/status/1631251260484509698,,2023-03-02,2023-03-02,arbiswap__2023-03-02__7e8101b1,defillama#2587
Yield Protocol,4/30/24,Protocol Logic,Balance Disparity Exploit,181000.0,Arbitrum,False,DeFi Protocol,,876.0,Solidity,https://twitter.com/peckshield/status/1785121607192817692,,2024-04-30,2024-04-30,yield-protocol__2024-04-30__2ada62d2,defillama#876
Audius,7/25/22,Protocol Logic,Malicious Governance Proposal,6000000.0,Ethereum,False,DeFi Protocol,,,Solidity,https://rekt.news/audius-rekt/,,2022-07-25,2022-07-25,audius__2022-07-25__903a187e,name#audius
LaunchZone,2/27/23,Protocol Logic,Access Control Exploit,700000.0,BSC,False,DeFi Protocol,,,Solidity,https://twitter.com/immunefi/status/1630210901360951296?s=20,,2023-02-27,2023-02-27,launchzone__2023-02-27__ba98ef58,name#launchzone
Ara Finance,6/19/23,Protocol Logic,Access Control Exploit,131000.0,BSC,False,DeFi Protocol,,1099.0,,https://twitter.com/Phalcon_xyz/status/1670700964272295936,,2023-06-19,2023-06-19,ara-finance__2023-06-19__b73cb640,defillama#1099
Trust Wallet,12/25/25,Infrastructure,Private Key Compromised (Supply Chain Attack),7000000.0,"Ethereum,Bitcoin,Solana",False,Wallet,,5577.0,,https://x.com/zachxbt/status/2004298839625195720,,2025-12-25,2025-12-25,trust-wallet__2025-12-25__451bfbdb,defillama#5577
TempleDAO,10/11/22,Protocol Logic,Exploit Lack of Input Authentication,2300000.0,Ethereum,False,DeFi Protocol,,875.0,Solidity,https://twitter.com/FrankResearcher/status/1579840347647414272?s=20&t=Ld2QjyQea4YYyVt3BKyJsA,parent#temple-dao,2022-10-11,2022-10-11,templedao__2022-10-11__045e0648,parent#temple-dao
